comment_id,text,user_name,airline
1151,quos eos sint voluptatibus similique iusto perferendis omnis voluptasearum nulla cumquedolorem consequatur officiis quis consequatur aspernatur nihil ullam etenim enim unde nihil labore non ducimus,savedgswnation0148,WN
1152,itaque veritatis explicaboquis voluptatem mollitia soluta id nondoloribus nobis fuga providentnesciunt saepe molestiae praesentium laboriosam,bestcoach138,G4
1153,et cumque error pariaturquo doloribus corrupti voluptates ad voluptatem consequatur voluptas dolorespariatur at quas iste repellat et sed quasiea maiores rerum aut earum,lalela912,WS
1154,quod magni consecteturquod doloremque velit autem ipsam nisi praesentium utlaboriosam quod delenitipariatur aliquam sint excepturi a consectetur quas eos,fraserwood814,AC
1155,animi asperiores modi et tenetur vel magniid iusto aliquid adnihil dolorem dolorum aut veritatis voluptatesomnis cupiditate incidunt,chrimarco81,AC
1156,dolorum voluptas laboriosam quisquam abtotam beatae et aut aliquid optio assumendavoluptas velit itaque quidem voluptatem tempore cupiditatein itaque sit molestiae minus dolores magni,jevic4642,AS
1157,voluptas quia quo adipsum voluptatum provident ut ipsam velit dignissimos aut assumendaut officia laudantiumquibusdam sed minima,weems841,F9
1158,et qui ad vero quisquisquam omnis fuga et vel nihil minima eligendi nostrumsed deserunt rem voluptates autemquia blanditiis cum sed,redrubin184,NK
1159,deserunt deleniti officiis architecto consequatur molestiae facere dolorvoluptatem velit eos fuga doloressit quia est a deleniti hic dolor quisquam repudiandaevoluptas numquam voluptatem impedit,vereenanthe65578,WN
1160,non reprehenderit aut sed quos est ad voluptatumest ut est dignissimos ut dolores consequunturdebitis aspernatur consequatur estporro nulla laboriosam repellendus et nesciunt est libero placeat,arm1474,UA
1161,sunt totam blanditiiseum quos fugit et ab rerum nemout iusto architectout et eligendi iure placeat omnis,yoderdrew741,AA
1162,nulla impedit porro in sedvoluptatem qui voluptas et enim beataenobis et sit ipsam autvoluptatem voluptatibus blanditiis officia quod eos omnis earum dolorem,bgson13,AA
1163,molestiae dolorem quae rem neque sapiente voluptatum nesciunt cumid rerum at blanditiis est accusantium esteos illo porro adquod repellendus ad et labore fugit dolorum,lrson31,F9
1164,beatae aut ut autem sit officia rerum nostrumprovident ratione sed dicta omnis alias commodi rerum expeditanon nobis sapiente consectetur odit unde quiavoluptas in nihil consequatur doloremque ullam dolorem cum,badankle148,DL
1165,sed praesentium ducimus minima autem corporis debitisaperiam eum sit pariaturimpedit placeat illo odioodit accusantium expedita quo rerum magnam,worstballbro831,AC
1166,nam quas eaque undedolor blanditiis cumque eaque omnis quirerum modi sint quae numquam exercitationematque aut praesentium ipsa sit neque qui sint aut,watisball381,G4
1167,molestiae voluptatem quiid facere nostrum quasi asperiores rerumquisquam est repellendusdeleniti eos aut sed nemo non,farokani418,B6
1168,cupiditate optio in quidem adipisci sit dolor idet tenetur quo sit oditaperiam illum optio magnam quimolestiae eligendi harum optio dolores dolor quaerat nostrum,morticapal13,WS
1169,unde non aliquid magni accusantium architecto etrerum autem eos explicabo etodio facilis sedrerum ex esse beatae quia,giataj134,AS
1170,amet id deserunt ipsamcupiditate distinctio nulla voluptatemcum possimus voluptateipsum quidem laudantium quos nihil,jordynil138,UA
1171,sed non beatae placeat qui libero nam eaque quiquia ut ad doloremquesequi unde quidem adipisci debitis autem velitarchitecto aperiam eos nihil enim dolores veritatis omnis ex,jordynaire81,B6
1172,nemo ullam omnis sitlabore perferendis et eveniet nostrumdignissimos expedita iustooccaecati quia sit quibusdam,galen183,NK
1173,asperiores hic fugiat aut et temporibus mollitia quo quamcumque numquam labore qui illum vel provident quodpariatur natus inciduntsunt error voluptatibus vel voluptas maiores est vero possimus,cheese134,B6
1174,sit dolores consequatur qui voluptas suntearum at natus alias excepturi doloresmaiores pariatur at reiciendisdolor esse optio,pangbang831,AS
1175,culpa non eaperspiciatis exercitationem sed natus sitenim voluptatum ratione omnis consequuntur provident commodi omnisquae odio sit at tempora,poiboi537,F9
1176,quam culpa fugiatrerum impedit ratione vel ipsam remcommodi qui rem eumitaque officiis omnis ad,sueme831,UA
1177,ut facilis sapientequia repellat autem et aut delectus sintautem nulla debitisomnis consequuntur neque,susueme72,UA
1178,sit maxime fugitsequi culpa optio consequatur voluptatem dolor expeditaenim iure eum reprehenderit doloremque aspernatur modivoluptatem culpa nostrum quod atque rerum sint laboriosam et,badlegsmith831,AS
1179,non saepe ipsa velit sunttotam ipsum optio voluptatemnesciunt qui iste eumet deleniti ullam,orr81,AS
1180,recusandae temporibus nihil non alias consequaturlibero voluptatem sed soluta accusamusa qui reiciendis officiis adquia laborum libero et rerum voluptas sed ut et,vilte15,AS
1181,dolor iure corruptiet eligendi nesciunt voluptatum autemconsequatur in sapientedolor voluptas dolores natus iusto qui et in perferendis,mayanmaryi41,UA
1182,voluptatum voluptatem nisi consequatur etomnis nobis odio neque ab enim veniamsit qui aperiam odit voluptatem facerenesciunt esse nemo,lyonbridgemaya8431,AS
1183,tempora soluta voluptas deseruntnon fugiat similiqueest natus enim eum error magni solutadolores sit doloremque,caditaxi81,WS
1184,odio saepe ad error minima itaqueomnis fuga corrupti qui eaque cupiditate eumvitae laborum rerum ut reprehenderit architecto sit debitis magnamqui corrupti cum quidem commodi facere corporis,njajv82,AA
1185,deleniti non et corrupti delectus ea cupiditateat nihil fuga rerumtemporibus doloribus unde sed aliasducimus perspiciatis quia debitis fuga,nade81,B6
1186,asperiores eaque error sunt ut natus et omnisexpedita error iste vitaesit alias voluptas voluptatibus quia iusto quia eaenim facere est quam ex,roseberry81,B6
1187,et enim necessitatibus velit autem magni voluptasat maxime error sunt nobis sitdolor beatae harum rerumtenetur facere pariatur et perferendis voluptas maiores nihil eaque,divadd81,DL
1188,quam magni adipisci totamut reprehenderit ut tempore non asperiores repellendus architecto aperiamdignissimos est aut reiciendis consectetur voluptate nihil culpa atmolestiae labore qui ea,valbeldel81,WN
1189,nostrum excepturi debitis cumarchitecto iusto laudantium odit aut dolor voluptatem consectetur nullamollitia beatae autem quasi nemo repellendus ut ea etaut architecto odio cum quod optio,biddidkid891,AC
1190,laudantium vero similique eumiure iste culpa praesentiummolestias doloremque alias et at doloribusaperiam natus est illo quo ratione porro excepturi,assume1,DL
1191,sit vero aut voluptatem soluta corrupti dolor cumnulla ipsa accusamus aut suscipit ut dicta ut nemout et ut sit voluptas modiillum suscipit ea debitis aut ullam harum,xisavaar1,G4
1192,dolore velit autem perferendis hictenetur quo rerumimpedit error sit eaque utad in expedita et nesciunt sit aspernatur repudiandae,tysoniluvu751,UA
1193,laudantium consequatur sed adipisci aodit quia necessitatibus quinumquam expedita est accusantium nostrumoccaecati perspiciatis molestiae nostrum atque,nicoa123,B6
1194,aut distinctio iusto autem sit libero delenitiest soluta non perferendis illoeveniet corrupti est sint quaesed sunt voluptatem,nicospon3,WN
1195,culpa voluptas quidem eos quis excepturiquasi corporis provident enimprovident velit ex occaecati delenitiid aspernatur fugiat eligendi,wiiniade88,B6
1196,eum laborum quidem omnis facere harum ducimus dolores quaeratcorporis quidem aliquidquod aut aut at dolorum aspernatur reiciendisexercitationem quasi consectetur asperiores vero blanditiis dolor,laka9,UA
1197,fugit ut laborum providentquos provident voluptatibus quam nonsed accusantium explicabo dolore quia distinctio voluptatibus etconsequatur eos qui iure minus eaque praesentium,mc6,UA
1198,est veritatis mollitia atque quas et sint et doloret ut beatae autmagni corporis dolores voluptatibus optio molestiae enim minus estreiciendis facere voluptate rem officia doloribus ut,trumnikola197,DL
1199,veniam eos ab voluptatem in fugiat ipsam quisofficiis non quiquia ut id voluptates et a molestiae commodi quamdolorem enim soluta impedit autem nulla,fmela96,WN
1200,facere maxime alias aspernatur ab quibusdam necessitatibusratione similique error enimsed minus etet provident minima voluptatibus,mjslander145,UA
1201,est officiis placeatid et iusto ut fugit numquameos aut voluptas ad quia tempore qui quibusdam doloremquerecusandae tempora qui,ponizzola128,G4
1202,sequi expedita quibusdam enim ipsambeatae ad eum placeatperspiciatis quis in nulla porro voluptas quiaesse et quibusdam,deemanbaum17665,AS
1203,eum voluptates id autem sequi qui omnis commodiveniam et laudantium autet molestias esse asperiores et quaeratpariatur non officia voluptatibus,handsypansy542,WS
1204,voluptatibus pariatur illoautem quia aut ullam laudantium quod laborum officiadicta sit consequatur quis delectus velomnis laboriosam laborum vero ipsa voluptas,hoielda148,G4
1205,voluptatem accusamus delectus natus quasi aliquidporro ab id ea aut consequatur dignissimos quod etaspernatur sapiente cum corruptipariatur veritatis unde,bopbopbop665,AA
1206,nam iusto minus expedita numquamet id quisvoluptatibus minima porro facilis dolores beatae aut sitaut quia suscipit,yessir875,UA
1207,nulla quos harum commodiaperiam qui et dignissimosreiciendis ut quia est corrupti itaquelaboriosam debitis suscipit,sepltoyta62,F9
1208,enim aut doloremque mollitia provident molestiae omnis esse excepturiofficiis tempora sequi molestiae veniam voluptatemrecusandae omnis temporibus et deleniti laborum sed ipsamolestiae eum aut,mrson1237,WN
1209,officiis qui eos voluptas laborum errorsunt repellat quis nisi unde velitdelectus eum molestias tempora quia ut autconsequatur cupiditate quis sint in eum voluptates,newlimbhaha53,AA
1210,praesentium odit quos et tempora eum voluptatem nonnon aut eaque consectetur reprehenderit in qui eos namnemo ea eosea nesciunt consequatur et,lusujath72,AC
1211,odio temporibus est ut aaut commodi minima tempora eumet fuga omnis alias deleniti facere totam undeimpedit voluptas et possimus consequatur necessitatibus qui velit,vroomvroom742,F9
1212,aut vero sint ut et voluptatesunt quod velit impedit quiacupiditate dicta magni uteos blanditiis assumenda pariatur nemo est tempore velit,gura6,B6
1213,at non dolore molestiaeautem rerum idcum facilis sit necessitatibus accusamus quia officiissint ea sit natus rerum est nemo perspiciatis ea,elon1,NK
1214,nam nesciunt earum sequi dolorumet fuga sint quae architectoin et et ipsam veniam ad voluptas rerum animiillum temporibus enim rerum est,nanamc15,DL
1215,esse ab est deleniti dicta noninventore veritatis cupiditateeligendi sequi excepturi assumenda a harum sint aut eaquererum molestias id excepturi quidem aut,lmayt7,B6
1216,minima quaerat voluptatibus iusto earumquia nihil etminus deleniti aspernatur voluptatibus tempore sit molestiasarchitecto velit id debitis,kingjames236,B6
1217,aperiam rerum aut provident cupiditate laboriosamenim placeat aut explicabovoluptatum similique rerum eaque eligendinobis occaecati perspiciatis sint ullam,ihatesteph31,NK
1218,rem qui estfacilis qui voluptatem quis est veniam quam aspernatur dictadolore id sapiente saepe consequaturenim qui impedit culpa ex qui voluptas dolor,fatherofshooter76,DL
1219,est et dolores voluptas aut molestiae nam eos saepeexpedita eum ea tempore sit iure evenietiusto enim quos quorepellendus laudantium eum fugiat aut et,nightnight30,UA
1220,illum ea eum quiadoloremque modi ducimus voluptatum eaque aperiam accusamus eos quiased rerum aperiam sunt quoea veritatis natus eos deserunt voluptas ea voluptate,momof3031,WS
1221,rerum possimus asperiores non dolores maiores tenetur absuscipit laudantium possimus ab iuredistinctio assumenda iste adipisci optio est sed eligenditemporibus perferendis tempore soluta,testmemf76,AS
1222,cum officiis impedit neque a sed dolorum accusamus eaquerepellat natus aut commodi sint fugit consequatur corporisvoluptatum dolorum sequi perspiciatis ut facilisdelectus pariatur consequatur at aut temporibus facere vitae,almostsplash6,DL
1223,maiores perspiciatis quo alias doloremqueillum iusto possimus impeditvelit voluptatem assumenda possimusut nesciunt eum et deleniti molestias harum excepturi,watiscurse1,WS
1224,perferendis quae est velit ipsa autem adipisci ex rerumvoluptatem occaecati velit perferendis aut teneturdeleniti eaque quasi suscipitdolorum nobis vel et aut est eos,tygalover8724,F9
1225,doloribus illum tempora aliquam qui perspiciatis dolorem ratione velitfacere nobis et fugiat modifugiat dolore atducimus voluptate porro qui architecto optio unde deleniti,retired22,AC
1226,provident sed similiqueexplicabo fugiat quasi saepe voluptatem corrupti recusandaevoluptas repudiandae illum tenetur mollitiasint in enim earum est,retired33,WN
1227,est quo quod tempora fuga debitiseum nihil nemo nisi consequatur sequi nesciunt dolorum etcumque maxime qui consequatur mollitia dicta iusto autvero recusandae ut dolorem provident voluptatibus suscipit sint,oldqb679,AC
1228,quibusdam dolores eveniet qui minimamagni perspiciatis pariaturullam dolor sit ex molestiae in nulla unde rerumquibusdam deleniti nisi,needtoretire12,UA
1229,unde aliquam ipsam eaque quia laboriosam exercitationem totam illonon et dolore ipsalaborum et sapiente fugit voluptatemet debitis quia optio et minima et nostrum,oldsuperman01927,UA
1230,neque ullam eos ametratione architecto doloribus qui est nisioccaecati unde expedita perspiciatis animi tenetur minus eveniet aspernatureius nihil adipisci aut,smartguy1887,F9
1231,veritatis laudantium laboriosam ut maxime sed voluptateconsequatur itaque occaecati voluptatum estut itaque aperiam eligendi at vel minusdicta tempora nihil pariatur libero est,dcarr86,NK
1232,ullam modi consequatur officia dolor non explicabo eteum minus dicta dolores blanditiis dolorenobis assumenda harum velit ullam et cupiditateet commodi dolor harum et sed cum reprehenderit omnis,newpatstar9813,F9
1233,aperiam quo quisnobis error et culpa veritatisquae sapiente nobis architecto doloribus quia laboriosamest consequatur et recusandae est eius,kastnerhe5472,B6
1234,itaque voluptatem voluptas velit non est rerum inciduntvitae aut labore accusantium in atquerepudiandae quos necessitatibusautem ea excepturi,bestcb0,B6
1235,ea iusto laboriosam sitvoluptatibus magni ratione eumet minus perferendiseius rerum suscipit velit culpa ipsa ipsam aperiam est,broofbestcb6,B6
1236,itaque error cupiditate asperiores ut aspernatur veniam quidoloribus sit aliquid pariatur dicta deleniti qui alias dignissimosrecusandae eaque repellendus est et dolorem aut nonexplicabo voluptas est beatae vel temporibus,wifeofshooter761,F9
1237,aut culpa quis modilibero hic dolore provident officiis placeat minima veroet iste dolores aut voluptatem saepe undevero temporibus sunt corrupti voluptate,pivot137,WN
1238,et nostrum cupiditate nobis facere et est illoconsequatur harum voluptatem totammolestiae voluptas consequatur quibusdam autmodi impedit necessitatibus et nisi nesciunt adipisci,rapforever7,NK
1239,esse rem ut neque magni voluptatem id quiaut ut vel autem non qui quam sitimpedit quis sit illum laborumaut at vel eos nihil quo,rapforever11,DL
1240,necessitatibus nulla perferendis ad inventore earum delectusvitae illo sed perferendisofficiis quo eligendi voluptatem animi totam perspiciatisrepellat quam eum placeat est tempore facere,inotaguy6542,F9
1241,quisquam asperiores voluptasmodi tempore officia quod hic dolor omnis asperioresarchitecto aut vel odio quisquam suntdeserunt soluta illum,bestillinirb0,AS
1242,dolores minus sequi laudantium excepturi deserunt rerum voluptatempariatur harum natus sed dolore quisconsectetur quod inventore laboriosam et in dolor beatae rerumquia rerum qui recusandae quo officiis fugit,qbsavior12,DL
1243,rem ut cumque tempore sedaperiam unde tenetur ab maiores officiis aliasaut nemo veniam dolor est eum sunt aesse ratione deserunt et,bballnotmysport1,UA
1244,est et itaque qui laboriosam dolor ut debitiscumque et et doloreaque enim et architectoet quia reiciendis quis,slimsnake7,AC
1245,vel nam nemo sed vitaerepellat necessitatibus dolores deserunt dolorumminima quae velit et nemosit expedita nihil consequatur autem quia maiores,uncledrew11,AS
1246,quia est sed eos animi optio dolorumconsequatur reiciendis exercitationem ipsum nihil omnisbeatae sed corporis enim quisquamet blanditiis qui nihil,strongboi0,DL
1247,explicabo nam nihil atque sint autqui qui rerum excepturi soluta quis etet mollitia et voluptate minima nihilsed quaerat dolor earum tempore et non est voluptatem,qbhfatesgr2,NK
1248,assumenda aut quis repellendusnihil impedit cupiditate nemosit sequi laudantium aut voluptas nam dolore magnamminima aspernatur vero sapiente,goawaytb12,AS
1249,non repudiandae dicta et commodisint dolores facere eos nesciunt autem quiaplaceat quaerat non culpa quasi dolores voluptasdolorum placeat non atque libero odit autem sunt,charger12,F9
1250,doloremque quae ratione cumqueexcepturi eligendi delectus maiores necessitatibus veniamfugiat exercitationem consectetur vel earumquia illo explicabo molestiae enim rem deserunt et omnis,weneedaqb265y,G4
1251,sit vero at voluptatem corporis adipiscierror sit aut nihil rerum doloremque dolorum ipsumeum ut numquam sapiente ipsam nam blanditiis ut quasifacilis optio rerum qui temporibus esse excepturi eaque,bphottie135,DL
1252,exercitationem quisquam sedeius et cum reiciendis deleniti nonperspiciatis aut voluptatum deseruntsint dignissimos est sed architecto sed,faceofbp138,WS
1253,debitis dignissimos ut illumrerum voluptatem ut qui laboreoptio quaerat iureiste consequuntur praesentium vero blanditiis quibusdam aut,vocalbp1479,G4
1254,laboriosam voluptas aut quibusdam mollitia sunt nondolores illum fugiat ex vero nemo aperiam porro quamexpedita est vel voluptatem sit voluptas consequuntur quis eligendiomnis id nisi ducimus sapiente odit quam,needsubs145,AS
1255,nihil esse autdebitis nostrum mollitia similique minus aspernatur possimusomnis eaque non evenietrerum qui iure laboriosam,cp3,WN
1256,nemo deleniti sunt praesentium quis quam repellendusconsequatur non est ex fugiat distinctio aliquam explicaboaspernatur omnis debitis sint consequaturquo autem natus veritatis,watisytteam10,WN
1257,facere at voluptatemrepellendus omnis perspiciatis placeat aspernatur nobis blanditiis ut delenitiquis non cumque laborum sit id ratione vel sequifacere doloremque beatae aut maxime non,omealsonwannable2,UA
1258,aut cum sint qui facere blanditiis magnam consequuntur perspiciatisharum impedit reprehenderit iste doloribus quia quo facereet explicabo aut voluptate modi doloremrem aut nobis ut ad voluptatum ipsum eos maxime,neeedawarrant3,UA
1259,itaque occaecati non aspernaturvelit repudiandae sit rerum esse quibusdam unde molestiasexplicabo dolorem vero consequatur quis et liberovoluptatem totam vel sapiente autem dolorum consequuntur,closetosummer572,AA
1260,aliquid molestias nemo aut est maximelaboriosam et consequatur laudantiumcommodi et corruptiharum quasi minima ratione sint magni sapiente ut,iloveduke8147,NK
1261,sapiente qui est quoddebitis qui est optio consequunturalias hic amet ut non ad qui providentquia provident aspernatur corrupti occaecati,aussyshooter8724,WS
1262,similique harum iste ipsam non dolores facere esseet beatae error necessitatibus laboriosam fugiat culpa esse occaecatiut provident ut et dolorum namdelectus impedit aut blanditiis fugiat est unde,cantshoot0,NK
1263,debitis dolore estut eos velit accusamusnon nobis ipsa nemo quas facilis quia hicofficia quam et possimus voluptas voluptatem quisquam tempore delectus,backfromacl1345,WS
1264,consectetur maiores ab est qui aliquid porroipsa labore inciduntiste deserunt quia aperiam quis sit perferendiset sint iste,4ringskids11,WS
1265,et quibusdam saepe labore delectus et earum quis perferendislaborum soluta veritatisea veritatis quidem accusantium est aut porro rerumquia est consequatur voluptatem numquam laudantium repellendus,twin1,DL
1266,non et voluptaseaque atque esse qui molestias porro quam veniam voluptatibusminima ut velit velit ut architecto delenitiab sint deserunt possimus quas velit et eum,twin2,AC
1267,magnam similique animi eos explicabo natusprovident cumque sit maxime velitveritatis fuga esse dolor hic nihil nesciunt assumendaaliquid vero modi alias qui quia doloribus est,nexstar9,DL
1268,velit earum perspiciatis ea recusandae nihil consectetur utmaxime repellendus doloribusaperiam ut ex ratione quia esse magniducimus rerum vel rerum officiis suscipit nihil qui,japbballstar82,F9
1269,quos sed unde repudiandae aut porro dignissimos quioccaecati sed alias enimvoluptates nesciunt sit ut adipisci estexpedita quae corrupti,nicesharpie18,AC
1270,quas placeat repudiandae a delectus facere exercitationem consecteturfacilis quas sequi est mollitiaest vero hic laudantium maioresquisquam itaque aut maxime ut cumque quia doloremque voluptatem,thomasthetrain4218,WN
1271,quae eaque reprehenderitsuscipit facilis ut tenetur blanditiis sint occaecatiaccusantium expedita sed nostrumrerum sunt nam qui placeat consequatur et,slimcenter84,AC
1272,consequuntur molestiae aut distinctio illo qui est sequi reprehenderithic accusamus et officiis reprehenderit culpaest et numquam eteius ipsa rerum velit,needaback148,DL
1273,asperiores et minus nondolor dolorem et sint et ipsamet enim quia sequised beatae culpa architecto nisi minima,boneshandles8,AA
1274,quos illo consectetur dolorescupiditate enim rerum dicta sequi totamaspernatur sed praesentiumipsum voluptates perspiciatis ipsa accusantium et et,popekent841,UA
1275,error et quasi qui facilis enim eum adipisci istead nostrum sint corporis quam velit necessitatibus aeius doloribus optio ad qui molestiaequaerat dignissimos voluptatem culpa aliquam explicabo commodi natus,lacfoever10,AS
1276,dolores tempora totam quas maxime voluptatem voluptas excepturirecusandae quis odio exercitationem inconsectetur sed autexcepturi eligendi sint consectetur repellendus aperiam,peyme28,WN
1277,nihil ratione aliquam recusandae ipsa sunt doloribus labore molestiaeofficia cum aliquid repudiandae et errorinventore minima optio repellat autea et maxime alias voluptas eius,reedpeedu8,AS
1278,corporis perferendis dolorum error quo rerum aut odio veritatissit deleniti aut eligendi quam doloremque aut ipsam sintdoloribus id voluptatem esse reprehenderit molestiae quia voluptatemincidunt illo beatae nihil corporis eligendi iure quo,whitepants842,WN
1279,natus atque ipsum voluptatem etnecessitatibus atque quia asperiores animi odit ratione quosest repellendus sit aut repudiandae animi autcum blanditiis repudiandae saepe laborum,bb9,B6
1280,perferendis fugit expedita cumqueexercitationem animi fugit aut earumnihil quia illum eum dicta utquam commodi optio,shortsmith0,F9
1281,eius voluptatem minuset aliquid perspiciatis sint unde utsimilique odio ullam vitae quisquam hic ex consequatur aliquidab nihil explicabo sint maiores aut et dolores nostrum,bestbig0,DL
1282,ea consequatur placeatquo omnis illum voluptatemvoluptatem fugit aut dolorum recusandae ut ettenetur officia voluptas,rustycanada10,WS
1283,perspiciatis omnis eum nihil et porro facilis fuga quideleniti id et velit adipisci fuga voluptatibus voluptatumdebitis tempore dolorem atque consequatur ea perspiciatis sedqui temporibus doloremque,nahbuddy138,UA
1284,rem ut sednon cumque corrupti vel nam rerum autemnobis dolorem necessitatibus fugit corporisquos sint distinctio ex et animi tempore,okshon2e8,DL
1285,est accusamus facerereprehenderit corporis ad et est fugit iure nulla etdoloribus reiciendis quasi autem voluptasipsam labore et pariatur quia,dunkcontestisrigged00,G4
1286,doloremque accusantium necessitatibus architecto ut providentquaerat iusto eius omnisfuga laborum harum totam sunt velitaut neque corporis atque,goatforever23,WN
1287,voluptatem perspiciatis voluptatum quaeratodit voluptates iurequisquam magnam voluptates ut non quialiquam aut ut amet sit consequatur ut suscipit,nextgswstar00,DL
1288,est sed illo omnis delectus autlaboriosam possimus incidunt est sunt atnemo voluptas ex ipsamvoluptatibus inventore velit sit et numquam omnis accusamus in,ddneedaring00,G4
1289,occaecati tempora undemaiores aliquid inquo libero sint quidem at est facilis ipsa facerenostrum atque harum,greenson013,F9
1290,pariatur veniam repellat quisquam tempore autem et voluptatem itaqueea impedit ex molestiae placeat hic harum mollitia doloreminventore accusantium aut quae quia rerum autem numquamnulla culpa quasi dolor,learningrol813,AA
1291,nisi dicta numquam dolorrerum sed quaerat etsed sequi doloribus libero quos temporibusblanditiis optio est tempore qui,imamoody81,WN
1292,eos officiis omnis ab laborum nulla saepe exercitationem recusandaevoluptate minima voluptatem sintsunt est consequuntur dolor voluptatem oditmaxime similique deserunt et quod,reliablecenter831,AA
1293,fugiat dicta quasi voluptatibus ea aut est aspernatur sedcorrupti harum non omnis eos eaque quos utquia et et nisi rerum voluptates possimus quisrecusandae aperiam quia esse,baldpatrick831,WS
1294,ut est veritatis animi quosnam sed doloritaque omnis nostrum autem molestiaeaut optio tempora ad sapiente quae voluptatem perferendis repellat,iggyisback9,DL
1295,voluptatem est aspernatur consequatur vel facereut omnis tenetur non ea eosquibusdam error odioatque consectetur voluptatem eligendi,needabrack81,UA
1296,quasi dolorem veniam dignissimosatque voluptas iure et quidem fugit velit etquod magnam illum quia et ea est modiaut quis dolores,heretosaveyall81,AS
