comment_id,text,user_name,airline
282,ea consequatur placeatquo omnis illum voluptatemvoluptatem fugit aut dolorum recusandae ut ettenetur officia voluptas,sueme831,DL
283,perspiciatis omnis eum nihil et porro facilis fuga quideleniti id et velit adipisci fuga voluptatibus voluptatumdebitis tempore dolorem atque consequatur ea perspiciatis sedqui temporibus doloremque,susueme72,F9
284,rem ut sednon cumque corrupti vel nam rerum autemnobis dolorem necessitatibus fugit corporisquos sint distinctio ex et animi tempore,badlegsmith831,F9
285,est accusamus facerereprehenderit corporis ad et est fugit iure nulla etdoloribus reiciendis quasi autem voluptasipsam labore et pariatur quia,orr81,AC
286,doloremque accusantium necessitatibus architecto ut providentquaerat iusto eius omnisfuga laborum harum totam sunt velitaut neque corporis atque,vilte15,NK
287,voluptatem perspiciatis voluptatum quaeratodit voluptates iurequisquam magnam voluptates ut non quialiquam aut ut amet sit consequatur ut suscipit,mayanmaryi41,AS
288,est sed illo omnis delectus autlaboriosam possimus incidunt est sunt atnemo voluptas ex ipsamvoluptatibus inventore velit sit et numquam omnis accusamus in,lyonbridgemaya8431,F9
289,occaecati tempora undemaiores aliquid inquo libero sint quidem at est facilis ipsa facerenostrum atque harum,caditaxi81,AA
290,pariatur veniam repellat quisquam tempore autem et voluptatem itaqueea impedit ex molestiae placeat hic harum mollitia doloreminventore accusantium aut quae quia rerum autem numquamnulla culpa quasi dolor,njajv82,WN
291,nisi dicta numquam dolorrerum sed quaerat etsed sequi doloribus libero quos temporibusblanditiis optio est tempore qui,nade81,DL
292,eos officiis omnis ab laborum nulla saepe exercitationem recusandaevoluptate minima voluptatem sintsunt est consequuntur dolor voluptatem oditmaxime similique deserunt et quod,roseberry81,F9
293,fugiat dicta quasi voluptatibus ea aut est aspernatur sedcorrupti harum non omnis eos eaque quos utquia et et nisi rerum voluptates possimus quisrecusandae aperiam quia esse,divadd81,G4
294,ut est veritatis animi quosnam sed doloritaque omnis nostrum autem molestiaeaut optio tempora ad sapiente quae voluptatem perferendis repellat,valbeldel81,AA
295,voluptatem est aspernatur consequatur vel facereut omnis tenetur non ea eosquibusdam error odioatque consectetur voluptatem eligendi,biddidkid891,WN
296,quasi dolorem veniam dignissimosatque voluptas iure et quidem fugit velit etquod magnam illum quia et ea est modiaut quis dolores,assume1,F9
297,eos exercitationem est ut voluptas accusamus quivelit rerum utdolorem eaque omnis eligendi mollitiaatque ea architecto dolorum delectus accusamus,xisavaar1,B6
298,molestiae accusantium a tempore occaecati qui sunt optio eosexercitationem quas eius voluptatemomnis quibusdam autemmolestiae odio dolor quam laboriosam mollitia in quibusdam sunt,tysoniluvu751,G4
299,voluptatem omnis pariatur aut saepe enim quiaut illo aut sed aperiam expedita debitistempore animi doloremut libero et eos unde ex,nicoa123,DL
300,dolorem fugit quidem animi quas quisquam reprehenderitoccaecati et dolor laborum nemo sed quas unde delenitifacere eligendi placeat aliquid aspernatur commodi sunt impeditneque corrupti alias molestiae magni tempora,nicospon3,AA
301,dolore maxime saepe dolor asperiores cupiditate nisi nesciuntvitae tempora ducimus vel eos perferendisfuga sequi numquam blanditiis sit sed inventore etut possimus soluta voluptas nihil aliquid sed earum,wiiniade88,B6
302,fuga aut est delectus earum optio impedit qui excepturiiusto consequatur deserunt soluta suntet autem nequedolor ut saepe dolores assumenda ipsa eligendi,laka9,AS
303,sit nesciunt id vitae ut itaque sapienteneque in at consequuntur perspiciatis dicta consequatur velitfacilis iste ut error sedin sequi expedita autem,mc6,B6
304,minus ab quis nihil quia suscipit velperspiciatis sunt undeaut ullam quo laudantium deleniti modirerum illo error occaecati vel officiis facere,trumnikola197,AC
305,repellendus quae labore sunt ut praesentium fuga reiciendis quiscorporis aut quis dolor facere earumexercitationem enim sunt nihil asperiores expeditaeius nesciunt a sit sit,fmela96,F9
306,ab veritatis aspernatur molestiae explicabo ea saepe molestias sequibeatae aut perferendis quaerat aut omnis illo fugiatquisquam hic doloribus maiores itaquevoluptas amet dolorem blanditiis,mjslander145,WS
307,sit tenetur aut eum quasi reiciendis dignissimos non nullarepellendus ut quisquamnumquam provident et repellendus eum nihil blanditiisbeatae iusto sed eius sit sed doloremque exercitationem nihil,ponizzola128,F9
308,officiis ipsa exercitationem impedit dolorem repellat adipisci quiatque illum sapiente omnis etnihil esse et eum facilis aut impeditmaxime ullam et dolorem,deemanbaum17665,DL
309,impedit qui nemoreprehenderit sequi praesentium ullam veniam quaerat optio qui erroraperiam qui quisquam dolor est blanditiis molestias rerum etquae quam eum odit ab quia est ut,handsypansy542,NK
310,quae quis qui ab rerum non hicconsequatur earum facilis atque quas dolore fuga ipsamnihil velit quisrerum sit nam est nulla nihil qui excepturi et,hoielda148,AC
311,officia provident libero explicabo tempora velit eligendi mollitia similiquererum sit aut consequatur ullam tenetur qui est verorerum est et explicabosit sunt ea exercitationem molestiae,bopbopbop665,WS
312,ipsa id eum dolorum et officiissaepe eos voluptatemnesciunt quos voluptas temporibus dolores ad rerumnon voluptatem aut fugit,yessir875,UA
313,corporis quo magnam sunt rerum enim velrepudiandae suscipit corrupti ut ab qui debitis quidem adipiscidistinctio voluptatibus vitae molestias incidunt laboriosam quia quidem facilisquia architecto libero illum ut dicta,sepltoyta62,NK
314,sunt cupiditate commodi est pariatur incidunt quissuscipit saepe magnam amet enimquod quis nequeet modi rerum asperiores consequatur reprehenderit maiores,mrson1237,WN
315,repudiandae dolores nam quaset incidunt odio dicta eum vero dolor quidemdolorem quisquam cumquemolestiae neque maxime rerum deserunt nam sequi,newlimbhaha53,B6
316,consequatur qui doloribus et rerumdebitis cum dolorem voluptate qui fuganecessitatibus quod temporibus non voluptatesaut saepe molestiae,lusujath72,AA
317,quam iste aut molestiae nesciunt modiatque quo laudantium vel tempora quam tenetur neque autet ipsum eum nostrum enim laboriosam officia eligendilaboriosam libero ullam sit nulla voluptate in,vroomvroom742,NK
318,distinctio placeat nisi repellat animised praesentium voluptatemplaceat eos blanditiis deleniti natus eveniet dolorum quia temporepariatur illum dolor aspernatur ratione tenetur autem ipsum fugit,gura6,AA
319,occaecati quia ipsa id fugit sunt velit iure adipisciullam inventore quidem dolorem adipisci optio quia etquis explicabo omnis ipsa quo ut voluptatem aliquam inventoreminima aut tempore excepturi similique,elon1,G4
320,nihil consequatur dolorem voluptatem non molestiaeodit eum animiipsum omnis ut quasivoluptas sed et et qui est aut,nanamc15,F9
321,ea necessitatibus eum nesciunt corporisminus in quisquam iste recusandaequi nobis deleniti asperiores non laboriosam sunt molestiae doloredistinctio qui officiis tempora dolorem ea,lmayt7,F9
322,id molestiae doloribusomnis atque eius sunt aperiamtenetur quia natus nihil sunt veritatis recusandae quiacorporis quam omnis veniam voluptas amet quidem illo deleniti,kingjames236,F9
323,explicabo dicta quas cum quis rerum dignissimos etmagnam sit mollitia est dolor voluptas sedipsum et tenetur recusandaequod facilis nulla amet deserunt,ihatesteph31,AS
324,ipsam eum ea distinctioducimus saepe eos quaerat molestiaecorporis aut officia qui ut perferendisitaque possimus incidunt aut quis,fatherofshooter76,WS
325,qui vero recusandaeporro esse sint doloribus impedit voluptatem commodiasperiores laudantium ut dolorespraesentium distinctio magnam voluptatum aut,nightnight30,NK
326,perspiciatis vero nulla aut consequatur fuga earum autnemo suscipit totam vitae qui at omnis autincidunt optio dolorem voluptatem velassumenda vero id explicabo deleniti sit corrupti sit,momof3031,UA
327,consequatur ut aut placeat harumquia perspiciatis unde doloribus quae nonut modi ad unde ducimus omnis nobis voluptatem atquemagnam reiciendis dolorem et qui explicabo,testmemf76,WN
328,molestiae minima aut rerum nesciuntvitae iusto consequatur architecto assumenda dolorumnon doloremque tempora possimus qui mollitia omnisvitae odit sed,almostsplash6,AS
329,nulla corrupti delectus est cupiditate explicabo faceresapiente quo id quis illo culpaut aut sit error magni atque asperiores solutaaut cumque voluptatem occaecati omnis aliquid,watiscurse1,AC
330,dolores tenetur rerum et aliquamculpa officiis ea rem neque modi quaerat deseruntmolestias minus nesciunt iusto impedit enim laborum perferendisvelit minima itaque voluptatem fugiat,tygalover8724,WS
331,maxime incidunt velit quam vel fugit nostrum veritatiset ipsam nisi voluptatem voluptas cumque tempora velit etet quisquam errormaiores fugit qui dolor sit doloribus,retired22,AA
332,voluptas iste delenitiest itaque vel ea incidunt quia voluptates sapiente repellataut consectetur vel neque tempora esse similique seda qui nobis voluptate hic eligendi doloribus molestiae et,retired33,WN
333,et dolor error doloremqueodio quo sunt quodest ipsam assumenda in veniam illum rerum deleniti expeditavoluptate hic nostrum sed dolor et qui,oldqb679,B6
334,et voluptatibus est et aperiam quaerat voluptate eius quonihil voluptas doloribus et ea temporelabore non doloremoptio consequatur est id quia magni voluptas enim,needtoretire12,DL
335,hic et et aspernatur voluptates voluptas ut ut idexcepturi eligendi aspernatur nulla dicta absuscipit quis distinctio nihiltemporibus unde quasi expedita et inventore consequatur rerum ab,oldsuperman01927,AS
336,similique autem voluptatem ab et etodio animi repellendus libero voluptas voluptas quialibero facere saepe nobisconsequatur et qui non hic ea maxime nihil,smartguy1887,WN
337,est ut aut ut omnis distinctioillum quisquam pariatur qui aspernatur vitaedolor explicabo architecto veritatis ipsa et aut est molestiaeducimus et sapiente error sed omnis,dcarr86,AA
338,maiores totam quo atqueexplicabo perferendis iste facilis odio ab eius consequatursit praesentium ea vitae optio minusvoluptate necessitatibus omnis itaque omnis qui,newpatstar9813,WN
339,dicta dolorem veniam ipsa harum minus sequiomnis quia voluptatem autemest optio doloribus repellendus id commodi quas exercitationem eumet eum dignissimos accusamus est eaque doloremque,kastnerhe5472,WN
340,est aut consequatur error illo utenim nihil fugasuscipit inventore officiis iure earum pariatur temporibus inaperiam qui quod vel necessitatibus velit eos exercitationem culpa,bestcb0,WS
341,iure ea ea neque estesse ab sed hic et ullam sed sequi anon hic tenetur sunt enim ealaudantium ea natus,broofbestcb6,F9
342,quis beatae quisequi dicta quas et dolornon enim aspernatur excepturi aut rerum asperioresaliquid animi nulla ea tempore esse,wifeofshooter761,UA
343,ea alias eos et corruptivoluptatem ab inciduntvoluptatibus voluptas ea nesciunttotam corporis dolor recusandae voluptas harum,pivot137,WN
344,iusto nihil quae rerum laborum recusandae voluptatem et necessitatibusut deserunt cumque qui quinon et et eos adipisci cupiditate dolor sed voluptatesmaiores commodi eveniet consequuntur,rapforever7,AC
345,omnis et fugit eos sint saepe ipsam unde estdolores sit sit assumenda laboriosamdolor deleniti voluptatem id nesciunt etplaceat dolorem cumque laboriosam sunt non,rapforever11,UA
346,quas non magnamquia veritatis assumenda reiciendissimilique dolores est abpraesentium fuga ut,inotaguy6542,NK
347,consectetur illo corporis sit labore optio quodqui occaecati aut sequi quiaofficiis quia aut odio quo adrerum tenetur aut quasi veniam,bestillinirb0,AC
348,perferendis dignissimos soluta ut provident sit etdelectus ratione ad sapiente qui excepturi error qui quoquo illo commodirerum maxime voluptas voluptatem,qbsavior12,AC
349,dicta impedit nonet laborum laudantium qui eaque et beatae suscipitsequi magnam rem dolorem non quia vel adipiscicorrupti officiis laudantium impedit,bballnotmysport1,G4
350,eaque rerum tempore distinctioconsequatur fugiat veniam et incidunt ut ut etconsequatur blanditiis magnamdoloremque voluptate ut architecto facere in dolorem et aut,slimsnake7,WN
351,quo nisi impedit velit repellendus esse itaque ut saepevoluptatibus occaecati ab eaque doloresmaxime alias velit ducimus placeat sit laudantium quiacorrupti doloremque ut,uncledrew11,AC
352,dolorem eius voluptatem vitae aliquid unde labore estmolestiae labore dolorem beatae voluptatem soluta eum eos doloreet ea quasi aut doloribus sintvel suscipit tempora delectus soluta,strongboi0,AC
353,nemo aut laborum expedita nisi sed illumab asperiores providenta sunt recusandae ut rerum itaque est voluptatibus nihilesse ipsum et repellendus nobis rerum voluptas et,qbhfatesgr2,AC
354,delectus est consequaturat excepturi asperiores dolor nesciunt adid non aut ad utnon et voluptatem,goawaytb12,WN
355,vel cumque labore vitae quisquam magnam sequi utmolestiae dolores vel minus autquas repellat nostrum fugit molestiae veritatis sequivel quidem in molestiae id doloribus sed,charger12,B6
356,fugiat dolore voluptas temporeaspernatur quibusdam rem iste sit fugiat nesciunt consequaturdolor sed odit similique minima corporis quae in adipisciimpedit dolores et cupiditate accusantium perferendis dignissimos error,weneedaqb265y,AA
357,et eos est quis quia molestiae estquasi est quos omnisaut et sit consectetur ex molestiaeest sed accusamus asperiores,bphottie135,NK
358,unde ad id nemo ipsam dolorem autem quaeratperspiciatis voluptas corrupti laborum rerum est architectoeius quos aut et voluptate voluptatem atque necessitatibusvoluptate fugiat aut iusto et atque,faceofbp138,NK
359,et explicabo voluptatem ut est nihil culpa etveritatis repellendus ipsum velit qui eligendi maxime voluptatem estdicta rerum et et nemo quiaeveniet aspernatur nostrum molestiae mollitia ut dolores rem fugiat,vocalbp1479,DL
360,sit et aut recusandaecorrupti nisi vero eius nulla voluptatesvoluptatem placeat est commodi impedit odio omnissimilique debitis et in molestiae omnis sed non magni,needsubs145,G4
361,cum ad porro fuga sequi doloresipsa error magni itaque labore accusamuscorporis odit consequatur quis debitiscum et voluptas facilis incidunt ut itaque dolores error,cp3,NK
362,excepturi omnis occaecati officiis enim saepe idnon quo et dignissimos voluptates ipsummolestias facere dolorem qui iure similique corruptineque ducimus sit alias dolor earum autem doloribus consequatur,watisytteam10,WN
363,est magni totam estet enim nam voluptas veritatis estsint doloremque incidunt et cum aet eligendi nobis ratione delectus,omealsonwannable2,WN
364,architecto quo enim ad et reprehenderitlaboriosam quia commodi officia iustodolorem totam consequuntur cupiditateveritatis voluptates aspernatur earum saepe et sed consequatur,neeedawarrant3,B6
365,modi sed aut quidem quisquam optio estaut facilis sit quia quis facere quodfugiat recusandae ex et quisquam ipsum sed sitexercitationem quia recusandae dolorem quasi iusto ipsa qui et,closetosummer572,AC
366,explicabo perspiciatis quae sit qui nulla incidunt facilisrepudiandae perspiciatis voluptate expedita sunt consectetur quasiid occaecati nesciunt dolorem aliquid perspiciatis repellat inventore esseut possimus exercitationem facere modi,iloveduke8147,NK
367,nostrum modi et et dolores maxime facerealias doloribus eaque expedita et similique voluptatum magnam estomnis eos voluptatemet unde fugit voluptatem asperiores,aussyshooter8724,B6
368,est dolor evenietest minus eveniet recusandaeiure quo aut eos ut sed ipsaharum earum aut nesciunt non dolores,cantshoot0,WN
369,qui fugit accusamuset quo minus cumque hic adipisciodio blanditiis omnis et estarchitecto et facilis inventore quasi provident quaerat ex rem,backfromacl1345,UA
370,beatae hic est et deserunt eiuscorrupti quam ut commodi sit modi est corporis animiharum ut estaperiam non fugit excepturi quo tenetur totam,4ringskids11,G4
371,est dicta totam architecto et minus id aut nonut et fugit eaque culpa modi repellendusaliquid qui veritatis doloribus aut consequatur voluptas sequi accusantiumvoluptas occaecati saepe reprehenderit ut,twin1,NK
372,aut illum est asperioresrerum laboriosam quis sit dolores magni minima fuga atqueomnis at et quibusdam earum remearum distinctio autem et enim dolore eos,twin2,WS
373,iure aliquid qui sitexcepturi dolorem rerum possimus suscipit atque nisilabore ut aut nihil voluptatum ut aliquid praesentiumassumenda tempore dolor velit ratione et corrupti,nexstar9,WS
374,eligendi et consequuntur dolor nihil quaerat doloremque utdignissimos sunt veniam non ratione essedebitis omnis similique maxime dolores tempora laborum rerum adipiscireiciendis explicabo error quidem quo necessitatibus voluptatibus vitae ipsum,japbballstar82,B6
375,non ea sed reprehenderit reiciendis eaque et neque adipisciipsa architecto deserunt ratione nesciunt tempore similique occaecati nonhic vitae sit nequererum quod dolorem ratione esse aperiam necessitatibus,nicesharpie18,UA
376,sint qui aut aspernatur necessitatibuslaboriosam autem occaecati nostrum nonofficiis consequuntur oditet itaque quam placeat aut molestiae saepe veniam provident,thomasthetrain4218,G4
377,sint fugit etid et saepe non molestiae sit earum doloremquedolorem nemo earum dignissimos ipsa soluta deleniti quosquis numquam ducimus sed corporis dolores sed quisquam suscipit,slimcenter84,WS
378,est molestiae non fugiat voluptatem quo porroaut praesentium ipsam aspernatur perferendis fugaofficia sit utaspernatur rerum est,needaback148,WS
379,laboriosam quia animi utquasi aut enim sequi numquam similique fugiat voluptatum nonsed velit quod nisi id quidemmagni in eveniet hic,boneshandles8,UA
380,voluptatum quis ipsa voluptatem saepe estillum error repellat eaque dolor quae quieum rerum sunt quam illovoluptates fuga possimus nemo nihil distinctio,popekent841,G4
381,consequatur possimus sit itaque distinctio fugit aut quodexplicabo exercitationem voluptas labore rerumporro ut in voluptas maiores tempora accusantiumvoluptatum et sapiente sit quas quis et veniam,lacfoever10,NK
382,eaque eius delectus molestias suscipit nulla quisquamtotam vel quos et autem sedeligendi et pariatur earum molestias magnam autemplaceat culpa est et qui commodi illo et,peyme28,G4
383,qui quaerat id repellendus aut quimaiores quidem consequatur dignissimos deleniti deserunt eveniet libero arepellat ducimus quia aut dignissimos numquam molestiaeconsequatur sit impedit nostrum et sunt iure,reedpeedu8,DL
384,blanditiis dolor sint nulla cum quidem aliquid voluptatemperferendis dolor consequatur voluptas et ut quisquam tempora teneturmaxime minus animi qui ideum accusantium et optio et blanditiis maxime,whitepants842,AS
385,sit fugiat est autem quia ipsam error abvoluptatem sed ab labore molestiae qui debitis exercitationemnon et sunt officia illo possimus iste tenetur estdolores voluptas ad aspernatur nihil,bb9,DL
386,et dicta dolores sitrepudiandae id harum temporibusvoluptas quia blanditiis numquam a enim quaequisquam assumenda nam doloribus vel temporibus distinctio eveniet dolores,shortsmith0,AS
387,qui recusandae veniam sed voluptatem ullam facilis consequaturnumquam ut quod aut etnon alias ex quam aut quasi ipsum praesentiumut aspernatur sit,bestbig0,AS
388,facilis et totamvoluptatibus est optio cumfacilis qui aut blanditiis rerum voluptatem accusamuset omnis quasi sint,rustycanada10,NK
389,dolore nihil perferendisdolor hic repudiandae istedoloribus labore quaerat et molestiae dolores sit excepturi sintet eum et aut,nahbuddy138,G4
390,dolor ratione ab repellendus aut quia reiciendis sedest alias exodio voluptatem velit odit tempora nihil optio aperiam blanditiislabore porro id velit dolor veritatis,okshon2e8,F9
391,aut repellat tenetur delectus eaque est nihil consequatur quaedeleniti assumenda voluptates sit sit cupiditate maioresautem suscipit sint tenetur dolor temporedolorem dolorum alias adipisci,dunkcontestisrigged00,F9
392,aut aut ea ut repudiandae ea assumenda laboriosamsunt qui laboriosam dicta omnis sit corporisvoluptas eos amet quam quisquam officiis facilis laborumvoluptatibus accusantium ab aliquid sed id doloremque,goatforever23,B6
393,et quia explicabout hic commodi quas provident aliquam nihilvitae in voluptatem commodivero velit optio omnis accusamus corrupti voluptatem,nextgswstar00,G4
394,voluptatem quisquam pariatur voluptatum qui quaeratet minus ea aliquam ullam dolorem consequaturratione at ad nemo aperiam excepturi delenitiqui numquam quis hic nostrum tempora quidem,ddneedaring00,AC
395,esse vel reiciendis nobis inventore vero estfugit inventore ea quo consequatur autautem deserunt ratione et repellendus nihil quamquidem iure est nihil mollitia,greenson013,AC
396,perferendis veritatis saepe voluptatemeum voluptas quissed occaecati nostrumfugit animi omnis ratione molestias,learningrol813,AA
397,ut nisi sunt perspiciatis qui doloribus quasvelit molestiae atque corrupti corporis voluptatemvel ratione aperiam tempore est eosquia a voluptas,imamoody81,AC
398,libero atque accusamus blanditiis minima eveniet corporis est aliquiddolores asperiores neque quibusdam quaerat error esse nonqui et adipiscimagni illo hic qui qui dignissimos earum,reliablecenter831,G4
399,corrupti ut et eveniet culpaveritatis eos sequi fugiat commodi consequunturipsa totam voluptatem perferendis ducimus aut exercitationem magnieos mollitia quia,baldpatrick831,NK
400,natus iure velit impedit sed officiis sintmolestiae non beataeillo consequatur minimased ratione est tenetur,iggyisback9,NK
401,sit delectus recusandae quiet cupiditate sed ipsum culpa et fugiat abillo dignissimos quo est repellat dolorum nequevoluptates sed sapiente ab aut rerum enim sint voluptatum,needabrack81,AS
402,et nisi fugit totammaiores voluptatibus quis ipsa sunt debitis assumendaullam non quasi numquam ut dolores modi recusandaeut molestias magni est voluptas quibusdam corporis eius,heretosaveyall81,G4
403,et a et perspiciatisautem expedita maiores dignissimos labore minus molestiae enimet ipsam ea etperspiciatis veritatis debitis maxime,wisejames91,UA
404,modi est et eveniet facilis explicabovoluptatem saepe quo et sint quas quia corporispariatur voluptatibus est iste fugiat delectus animi rerumdoloribus est enim,antlamb1,G4
405,aut aut sit cupiditate maxime praesentium occaecati cumquevero sint sit aliquam porro quo consequuntur utnumquam qui maxime voluptas est consequatur ullamtenetur commodi qui consectetur distinctio eligendi atque,jacklamb89,NK
406,dicta in quam tenetursed molestiae a sit est aut quia autem autnam voluptatem reiciendis corporis voluptatemsapiente est id quia explicabo enim tempora asperiores,savedgswnation0148,WN
407,totam ad quia non vero dolor laudantium sed temporibusquia aperiam corrupti sint accusantium eligendialiquam rerum voluptatem delectus numquam nihilsoluta qui sequi nisi voluptatum eaque voluptas animi ipsam,bestcoach138,AS
408,suscipit quidem fugiat consequaturquo sequi nesciuntaliquam ratione possimusvoluptatem sit quia repellendus libero excepturi ut temporibus,lalela912,B6
409,provident illo quis dolor distinctio laborum eius enimsuscipit quia error enim eos consequunturest incidunt adipisci beatae tenetur excepturi in labore commodifugiat omnis in et at nam accusamus et,fraserwood814,AC
410,in consequatur corporis qui a et magni eum illumcorrupti veniam debitis ab iure harumenim ut assumenda cum adipisci veritatis et veniamrem eius expedita quos corrupti incidunt,chrimarco81,B6
411,nam voluptatem ex aut voluptatem mollitia sit sapientequi hic utqui natus in iste et magnam dolores et fugitea sint ut minima quas eum nobis at reprehenderit,jevic4642,UA
412,veniam non culpa aut voluptas rem eum officiismollitia placeat eos cumconsequatur eos commodi doloremanimi maiores qui,weems841,AS
413,consequatur harum est omnisqui recusandae qui voluptatem et distinctio sint eaquedolores quo dolorem asperioresaperiam non quis asperiores aut praesentium,redrubin184,AA
414,molestias debitis magni illo sint officiis ut quiased tenetur dolorem solutavoluptatem fugiat voluptas molestiae magnam fugasimilique enim illum voluptas aspernatur officia,vereenanthe65578,UA
415,iure vitae accusamus tenetur autem ipsa delenitisunt laudantium ut beatae repellendus non eosut consequuntur repudiandae ducimus enimreiciendis rem explicabo magni dolore,arm1474,AA
416,enim velit consequatur excepturi corporis voluptatem nostrumnesciunt alias perspiciatis corporisneque at eius porro sapiente ratione maiores natusfacere molestiae vel explicabo voluptas unde,yoderdrew741,DL
417,et vitae consectetur ut voluptatemet et eveniet sitincidunt tenetur voluptatemprovident occaecati exercitationem neque placeat,bgson13,B6
418,animi est eveniet officiis quiaperiam dolore occaecati enim aut reiciendisanimi ad sint labore blanditiis adipisci voluptatibus eius erroromnis rerum facere architecto occaecati rerum,lrson31,B6
419,cum neque recusandae occaecati aliquam reprehenderit ullam saepe veniamquasi ea provident tenetur architecto adcupiditate molestiae mollitia molestias debitis eveniet doloremque voluptatem autdolore consequatur nihil facere et,badankle148,UA
420,voluptas cum eum minima remdolorem et nemo repellendus voluptatem sitrepudiandae nulla qui recusandae nobisblanditiis perspiciatis dolor ipsam reprehenderit odio,worstballbro831,AC
421,voluptate libero corrupti facere totam eaque consequatur nemoenim aliquid exercitationem nulla dignissimos illoest amet non iureamet sed dolore non ipsam magni,watisball381,UA
422,ducimus ut ut fugiat nesciunt laboredeleniti non et aut voluptatum quidem consecteturincidunt voluptas accusantiumquo fuga eaque quisquam et et sapiente aut,farokani418,NK
423,rerum laborum voluptas ipsa enim praesentiumquisquam aliquid perspiciatis eveniet id est est facilisatque aut facereprovident reiciendis libero atque est,morticapal13,AS
