comment_id,text,user_name,airline
720,illum ea eum quiadoloremque modi ducimus voluptatum eaque aperiam accusamus eos quiased rerum aperiam sunt quoea veritatis natus eos deserunt voluptas ea voluptate,farokani418,AS
721,rerum possimus asperiores non dolores maiores tenetur absuscipit laudantium possimus ab iuredistinctio assumenda iste adipisci optio est sed eligenditemporibus perferendis tempore soluta,morticapal13,WS
722,cum officiis impedit neque a sed dolorum accusamus eaquerepellat natus aut commodi sint fugit consequatur corporisvoluptatum dolorum sequi perspiciatis ut facilisdelectus pariatur consequatur at aut temporibus facere vitae,giataj134,AS
723,maiores perspiciatis quo alias doloremqueillum iusto possimus impeditvelit voluptatem assumenda possimusut nesciunt eum et deleniti molestias harum excepturi,jordynil138,UA
724,perferendis quae est velit ipsa autem adipisci ex rerumvoluptatem occaecati velit perferendis aut teneturdeleniti eaque quasi suscipitdolorum nobis vel et aut est eos,jordynaire81,B6
725,doloribus illum tempora aliquam qui perspiciatis dolorem ratione velitfacere nobis et fugiat modifugiat dolore atducimus voluptate porro qui architecto optio unde deleniti,galen183,NK
726,provident sed similiqueexplicabo fugiat quasi saepe voluptatem corrupti recusandaevoluptas repudiandae illum tenetur mollitiasint in enim earum est,cheese134,G4
727,est quo quod tempora fuga debitiseum nihil nemo nisi consequatur sequi nesciunt dolorum etcumque maxime qui consequatur mollitia dicta iusto autvero recusandae ut dolorem provident voluptatibus suscipit sint,pangbang831,AC
728,quibusdam dolores eveniet qui minimamagni perspiciatis pariaturullam dolor sit ex molestiae in nulla unde rerumquibusdam deleniti nisi,poiboi537,WS
729,unde aliquam ipsam eaque quia laboriosam exercitationem totam illonon et dolore ipsalaborum et sapiente fugit voluptatemet debitis quia optio et minima et nostrum,sueme831,F9
730,neque ullam eos ametratione architecto doloribus qui est nisioccaecati unde expedita perspiciatis animi tenetur minus eveniet aspernatureius nihil adipisci aut,susueme72,AC
731,veritatis laudantium laboriosam ut maxime sed voluptateconsequatur itaque occaecati voluptatum estut itaque aperiam eligendi at vel minusdicta tempora nihil pariatur libero est,badlegsmith831,AS
732,ullam modi consequatur officia dolor non explicabo eteum minus dicta dolores blanditiis dolorenobis assumenda harum velit ullam et cupiditateet commodi dolor harum et sed cum reprehenderit omnis,orr81,DL
733,aperiam quo quisnobis error et culpa veritatisquae sapiente nobis architecto doloribus quia laboriosamest consequatur et recusandae est eius,vilte15,F9
734,itaque voluptatem voluptas velit non est rerum inciduntvitae aut labore accusantium in atquerepudiandae quos necessitatibusautem ea excepturi,mayanmaryi41,WS
735,ea iusto laboriosam sitvoluptatibus magni ratione eumet minus perferendiseius rerum suscipit velit culpa ipsa ipsam aperiam est,lyonbridgemaya8431,NK
736,itaque error cupiditate asperiores ut aspernatur veniam quidoloribus sit aliquid pariatur dicta deleniti qui alias dignissimosrecusandae eaque repellendus est et dolorem aut nonexplicabo voluptas est beatae vel temporibus,caditaxi81,B6
737,aut culpa quis modilibero hic dolore provident officiis placeat minima veroet iste dolores aut voluptatem saepe undevero temporibus sunt corrupti voluptate,njajv82,B6
738,et nostrum cupiditate nobis facere et est illoconsequatur harum voluptatem totammolestiae voluptas consequatur quibusdam autmodi impedit necessitatibus et nisi nesciunt adipisci,nade81,DL
739,esse rem ut neque magni voluptatem id quiaut ut vel autem non qui quam sitimpedit quis sit illum laborumaut at vel eos nihil quo,roseberry81,WS
740,necessitatibus nulla perferendis ad inventore earum delectusvitae illo sed perferendisofficiis quo eligendi voluptatem animi totam perspiciatisrepellat quam eum placeat est tempore facere,divadd81,AC
741,quisquam asperiores voluptasmodi tempore officia quod hic dolor omnis asperioresarchitecto aut vel odio quisquam suntdeserunt soluta illum,valbeldel81,B6
742,dolores minus sequi laudantium excepturi deserunt rerum voluptatempariatur harum natus sed dolore quisconsectetur quod inventore laboriosam et in dolor beatae rerumquia rerum qui recusandae quo officiis fugit,biddidkid891,UA
743,rem ut cumque tempore sedaperiam unde tenetur ab maiores officiis aliasaut nemo veniam dolor est eum sunt aesse ratione deserunt et,assume1,AC
744,est et itaque qui laboriosam dolor ut debitiscumque et et doloreaque enim et architectoet quia reiciendis quis,xisavaar1,AS
745,vel nam nemo sed vitaerepellat necessitatibus dolores deserunt dolorumminima quae velit et nemosit expedita nihil consequatur autem quia maiores,tysoniluvu751,NK
746,quia est sed eos animi optio dolorumconsequatur reiciendis exercitationem ipsum nihil omnisbeatae sed corporis enim quisquamet blanditiis qui nihil,nicoa123,UA
747,explicabo nam nihil atque sint autqui qui rerum excepturi soluta quis etet mollitia et voluptate minima nihilsed quaerat dolor earum tempore et non est voluptatem,nicospon3,WS
748,assumenda aut quis repellendusnihil impedit cupiditate nemosit sequi laudantium aut voluptas nam dolore magnamminima aspernatur vero sapiente,wiiniade88,AC
749,non repudiandae dicta et commodisint dolores facere eos nesciunt autem quiaplaceat quaerat non culpa quasi dolores voluptasdolorum placeat non atque libero odit autem sunt,laka9,WS
750,doloremque quae ratione cumqueexcepturi eligendi delectus maiores necessitatibus veniamfugiat exercitationem consectetur vel earumquia illo explicabo molestiae enim rem deserunt et omnis,mc6,AA
751,sit vero at voluptatem corporis adipiscierror sit aut nihil rerum doloremque dolorum ipsumeum ut numquam sapiente ipsam nam blanditiis ut quasifacilis optio rerum qui temporibus esse excepturi eaque,trumnikola197,WN
752,exercitationem quisquam sedeius et cum reiciendis deleniti nonperspiciatis aut voluptatum deseruntsint dignissimos est sed architecto sed,fmela96,NK
753,debitis dignissimos ut illumrerum voluptatem ut qui laboreoptio quaerat iureiste consequuntur praesentium vero blanditiis quibusdam aut,mjslander145,WS
754,laboriosam voluptas aut quibusdam mollitia sunt nondolores illum fugiat ex vero nemo aperiam porro quamexpedita est vel voluptatem sit voluptas consequuntur quis eligendiomnis id nisi ducimus sapiente odit quam,ponizzola128,AA
755,nihil esse autdebitis nostrum mollitia similique minus aspernatur possimusomnis eaque non evenietrerum qui iure laboriosam,deemanbaum17665,WS
756,nemo deleniti sunt praesentium quis quam repellendusconsequatur non est ex fugiat distinctio aliquam explicaboaspernatur omnis debitis sint consequaturquo autem natus veritatis,handsypansy542,AA
757,facere at voluptatemrepellendus omnis perspiciatis placeat aspernatur nobis blanditiis ut delenitiquis non cumque laborum sit id ratione vel sequifacere doloremque beatae aut maxime non,hoielda148,WN
758,aut cum sint qui facere blanditiis magnam consequuntur perspiciatisharum impedit reprehenderit iste doloribus quia quo facereet explicabo aut voluptate modi doloremrem aut nobis ut ad voluptatum ipsum eos maxime,bopbopbop665,WS
759,itaque occaecati non aspernaturvelit repudiandae sit rerum esse quibusdam unde molestiasexplicabo dolorem vero consequatur quis et liberovoluptatem totam vel sapiente autem dolorum consequuntur,yessir875,WN
760,aliquid molestias nemo aut est maximelaboriosam et consequatur laudantiumcommodi et corruptiharum quasi minima ratione sint magni sapiente ut,sepltoyta62,UA
761,sapiente qui est quoddebitis qui est optio consequunturalias hic amet ut non ad qui providentquia provident aspernatur corrupti occaecati,mrson1237,B6
762,similique harum iste ipsam non dolores facere esseet beatae error necessitatibus laboriosam fugiat culpa esse occaecatiut provident ut et dolorum namdelectus impedit aut blanditiis fugiat est unde,newlimbhaha53,UA
763,debitis dolore estut eos velit accusamusnon nobis ipsa nemo quas facilis quia hicofficia quam et possimus voluptas voluptatem quisquam tempore delectus,lusujath72,DL
764,consectetur maiores ab est qui aliquid porroipsa labore inciduntiste deserunt quia aperiam quis sit perferendiset sint iste,vroomvroom742,WS
765,et quibusdam saepe labore delectus et earum quis perferendislaborum soluta veritatisea veritatis quidem accusantium est aut porro rerumquia est consequatur voluptatem numquam laudantium repellendus,gura6,AS
766,non et voluptaseaque atque esse qui molestias porro quam veniam voluptatibusminima ut velit velit ut architecto delenitiab sint deserunt possimus quas velit et eum,elon1,NK
767,magnam similique animi eos explicabo natusprovident cumque sit maxime velitveritatis fuga esse dolor hic nihil nesciunt assumendaaliquid vero modi alias qui quia doloribus est,nanamc15,F9
768,velit earum perspiciatis ea recusandae nihil consectetur utmaxime repellendus doloribusaperiam ut ex ratione quia esse magniducimus rerum vel rerum officiis suscipit nihil qui,lmayt7,F9
769,quos sed unde repudiandae aut porro dignissimos quioccaecati sed alias enimvoluptates nesciunt sit ut adipisci estexpedita quae corrupti,kingjames236,AC
770,quas placeat repudiandae a delectus facere exercitationem consecteturfacilis quas sequi est mollitiaest vero hic laudantium maioresquisquam itaque aut maxime ut cumque quia doloremque voluptatem,ihatesteph31,AS
771,quae eaque reprehenderitsuscipit facilis ut tenetur blanditiis sint occaecatiaccusantium expedita sed nostrumrerum sunt nam qui placeat consequatur et,fatherofshooter76,G4
772,consequuntur molestiae aut distinctio illo qui est sequi reprehenderithic accusamus et officiis reprehenderit culpaest et numquam eteius ipsa rerum velit,nightnight30,UA
773,asperiores et minus nondolor dolorem et sint et ipsamet enim quia sequised beatae culpa architecto nisi minima,momof3031,B6
774,quos illo consectetur dolorescupiditate enim rerum dicta sequi totamaspernatur sed praesentiumipsum voluptates perspiciatis ipsa accusantium et et,testmemf76,UA
775,error et quasi qui facilis enim eum adipisci istead nostrum sint corporis quam velit necessitatibus aeius doloribus optio ad qui molestiaequaerat dignissimos voluptatem culpa aliquam explicabo commodi natus,almostsplash6,DL
776,dolores tempora totam quas maxime voluptatem voluptas excepturirecusandae quis odio exercitationem inconsectetur sed autexcepturi eligendi sint consectetur repellendus aperiam,watiscurse1,AS
777,nihil ratione aliquam recusandae ipsa sunt doloribus labore molestiaeofficia cum aliquid repudiandae et errorinventore minima optio repellat autea et maxime alias voluptas eius,tygalover8724,AS
778,corporis perferendis dolorum error quo rerum aut odio veritatissit deleniti aut eligendi quam doloremque aut ipsam sintdoloribus id voluptatem esse reprehenderit molestiae quia voluptatemincidunt illo beatae nihil corporis eligendi iure quo,retired22,WS
779,natus atque ipsum voluptatem etnecessitatibus atque quia asperiores animi odit ratione quosest repellendus sit aut repudiandae animi autcum blanditiis repudiandae saepe laborum,retired33,G4
780,perferendis fugit expedita cumqueexercitationem animi fugit aut earumnihil quia illum eum dicta utquam commodi optio,oldqb679,F9
781,eius voluptatem minuset aliquid perspiciatis sint unde utsimilique odio ullam vitae quisquam hic ex consequatur aliquidab nihil explicabo sint maiores aut et dolores nostrum,needtoretire12,G4
782,ea consequatur placeatquo omnis illum voluptatemvoluptatem fugit aut dolorum recusandae ut ettenetur officia voluptas,oldsuperman01927,F9
783,perspiciatis omnis eum nihil et porro facilis fuga quideleniti id et velit adipisci fuga voluptatibus voluptatumdebitis tempore dolorem atque consequatur ea perspiciatis sedqui temporibus doloremque,smartguy1887,AS
784,rem ut sednon cumque corrupti vel nam rerum autemnobis dolorem necessitatibus fugit corporisquos sint distinctio ex et animi tempore,dcarr86,G4
785,est accusamus facerereprehenderit corporis ad et est fugit iure nulla etdoloribus reiciendis quasi autem voluptasipsam labore et pariatur quia,newpatstar9813,G4
786,doloremque accusantium necessitatibus architecto ut providentquaerat iusto eius omnisfuga laborum harum totam sunt velitaut neque corporis atque,kastnerhe5472,WS
787,voluptatem perspiciatis voluptatum quaeratodit voluptates iurequisquam magnam voluptates ut non quialiquam aut ut amet sit consequatur ut suscipit,bestcb0,AA
788,est sed illo omnis delectus autlaboriosam possimus incidunt est sunt atnemo voluptas ex ipsamvoluptatibus inventore velit sit et numquam omnis accusamus in,broofbestcb6,WS
789,occaecati tempora undemaiores aliquid inquo libero sint quidem at est facilis ipsa facerenostrum atque harum,wifeofshooter761,WS
790,pariatur veniam repellat quisquam tempore autem et voluptatem itaqueea impedit ex molestiae placeat hic harum mollitia doloreminventore accusantium aut quae quia rerum autem numquamnulla culpa quasi dolor,pivot137,B6
791,nisi dicta numquam dolorrerum sed quaerat etsed sequi doloribus libero quos temporibusblanditiis optio est tempore qui,rapforever7,F9
792,eos officiis omnis ab laborum nulla saepe exercitationem recusandaevoluptate minima voluptatem sintsunt est consequuntur dolor voluptatem oditmaxime similique deserunt et quod,rapforever11,DL
793,fugiat dicta quasi voluptatibus ea aut est aspernatur sedcorrupti harum non omnis eos eaque quos utquia et et nisi rerum voluptates possimus quisrecusandae aperiam quia esse,inotaguy6542,AS
794,ut est veritatis animi quosnam sed doloritaque omnis nostrum autem molestiaeaut optio tempora ad sapiente quae voluptatem perferendis repellat,bestillinirb0,WS
795,voluptatem est aspernatur consequatur vel facereut omnis tenetur non ea eosquibusdam error odioatque consectetur voluptatem eligendi,qbsavior12,WN
796,quasi dolorem veniam dignissimosatque voluptas iure et quidem fugit velit etquod magnam illum quia et ea est modiaut quis dolores,bballnotmysport1,UA
797,eos exercitationem est ut voluptas accusamus quivelit rerum utdolorem eaque omnis eligendi mollitiaatque ea architecto dolorum delectus accusamus,slimsnake7,WS
798,molestiae accusantium a tempore occaecati qui sunt optio eosexercitationem quas eius voluptatemomnis quibusdam autemmolestiae odio dolor quam laboriosam mollitia in quibusdam sunt,uncledrew11,AA
799,voluptatem omnis pariatur aut saepe enim quiaut illo aut sed aperiam expedita debitistempore animi doloremut libero et eos unde ex,strongboi0,WN
800,dolorem fugit quidem animi quas quisquam reprehenderitoccaecati et dolor laborum nemo sed quas unde delenitifacere eligendi placeat aliquid aspernatur commodi sunt impeditneque corrupti alias molestiae magni tempora,qbhfatesgr2,WN
801,dolore maxime saepe dolor asperiores cupiditate nisi nesciuntvitae tempora ducimus vel eos perferendisfuga sequi numquam blanditiis sit sed inventore etut possimus soluta voluptas nihil aliquid sed earum,goawaytb12,UA
802,fuga aut est delectus earum optio impedit qui excepturiiusto consequatur deserunt soluta suntet autem nequedolor ut saepe dolores assumenda ipsa eligendi,charger12,NK
803,sit nesciunt id vitae ut itaque sapienteneque in at consequuntur perspiciatis dicta consequatur velitfacilis iste ut error sedin sequi expedita autem,weneedaqb265y,UA
804,minus ab quis nihil quia suscipit velperspiciatis sunt undeaut ullam quo laudantium deleniti modirerum illo error occaecati vel officiis facere,bphottie135,AC
805,repellendus quae labore sunt ut praesentium fuga reiciendis quiscorporis aut quis dolor facere earumexercitationem enim sunt nihil asperiores expeditaeius nesciunt a sit sit,faceofbp138,G4
806,ab veritatis aspernatur molestiae explicabo ea saepe molestias sequibeatae aut perferendis quaerat aut omnis illo fugiatquisquam hic doloribus maiores itaquevoluptas amet dolorem blanditiis,vocalbp1479,AC
807,sit tenetur aut eum quasi reiciendis dignissimos non nullarepellendus ut quisquamnumquam provident et repellendus eum nihil blanditiisbeatae iusto sed eius sit sed doloremque exercitationem nihil,needsubs145,G4
808,officiis ipsa exercitationem impedit dolorem repellat adipisci quiatque illum sapiente omnis etnihil esse et eum facilis aut impeditmaxime ullam et dolorem,cp3,B6
809,impedit qui nemoreprehenderit sequi praesentium ullam veniam quaerat optio qui erroraperiam qui quisquam dolor est blanditiis molestias rerum etquae quam eum odit ab quia est ut,watisytteam10,B6
810,quae quis qui ab rerum non hicconsequatur earum facilis atque quas dolore fuga ipsamnihil velit quisrerum sit nam est nulla nihil qui excepturi et,omealsonwannable2,G4
811,officia provident libero explicabo tempora velit eligendi mollitia similiquererum sit aut consequatur ullam tenetur qui est verorerum est et explicabosit sunt ea exercitationem molestiae,neeedawarrant3,AC
812,ipsa id eum dolorum et officiissaepe eos voluptatemnesciunt quos voluptas temporibus dolores ad rerumnon voluptatem aut fugit,closetosummer572,AS
813,corporis quo magnam sunt rerum enim velrepudiandae suscipit corrupti ut ab qui debitis quidem adipiscidistinctio voluptatibus vitae molestias incidunt laboriosam quia quidem facilisquia architecto libero illum ut dicta,iloveduke8147,AS
814,sunt cupiditate commodi est pariatur incidunt quissuscipit saepe magnam amet enimquod quis nequeet modi rerum asperiores consequatur reprehenderit maiores,aussyshooter8724,G4
815,repudiandae dolores nam quaset incidunt odio dicta eum vero dolor quidemdolorem quisquam cumquemolestiae neque maxime rerum deserunt nam sequi,cantshoot0,B6
816,consequatur qui doloribus et rerumdebitis cum dolorem voluptate qui fuganecessitatibus quod temporibus non voluptatesaut saepe molestiae,backfromacl1345,AC
817,quam iste aut molestiae nesciunt modiatque quo laudantium vel tempora quam tenetur neque autet ipsum eum nostrum enim laboriosam officia eligendilaboriosam libero ullam sit nulla voluptate in,4ringskids11,NK
818,distinctio placeat nisi repellat animised praesentium voluptatemplaceat eos blanditiis deleniti natus eveniet dolorum quia temporepariatur illum dolor aspernatur ratione tenetur autem ipsum fugit,twin1,DL
819,occaecati quia ipsa id fugit sunt velit iure adipisciullam inventore quidem dolorem adipisci optio quia etquis explicabo omnis ipsa quo ut voluptatem aliquam inventoreminima aut tempore excepturi similique,twin2,AA
820,nihil consequatur dolorem voluptatem non molestiaeodit eum animiipsum omnis ut quasivoluptas sed et et qui est aut,nexstar9,AS
821,ea necessitatibus eum nesciunt corporisminus in quisquam iste recusandaequi nobis deleniti asperiores non laboriosam sunt molestiae doloredistinctio qui officiis tempora dolorem ea,japbballstar82,WN
822,id molestiae doloribusomnis atque eius sunt aperiamtenetur quia natus nihil sunt veritatis recusandae quiacorporis quam omnis veniam voluptas amet quidem illo deleniti,nicesharpie18,G4
823,explicabo dicta quas cum quis rerum dignissimos etmagnam sit mollitia est dolor voluptas sedipsum et tenetur recusandaequod facilis nulla amet deserunt,thomasthetrain4218,AS
824,ipsam eum ea distinctioducimus saepe eos quaerat molestiaecorporis aut officia qui ut perferendisitaque possimus incidunt aut quis,slimcenter84,B6
825,qui vero recusandaeporro esse sint doloribus impedit voluptatem commodiasperiores laudantium ut dolorespraesentium distinctio magnam voluptatum aut,needaback148,NK
826,perspiciatis vero nulla aut consequatur fuga earum autnemo suscipit totam vitae qui at omnis autincidunt optio dolorem voluptatem velassumenda vero id explicabo deleniti sit corrupti sit,boneshandles8,NK
827,consequatur ut aut placeat harumquia perspiciatis unde doloribus quae nonut modi ad unde ducimus omnis nobis voluptatem atquemagnam reiciendis dolorem et qui explicabo,popekent841,B6
828,molestiae minima aut rerum nesciuntvitae iusto consequatur architecto assumenda dolorumnon doloremque tempora possimus qui mollitia omnisvitae odit sed,lacfoever10,DL
829,nulla corrupti delectus est cupiditate explicabo faceresapiente quo id quis illo culpaut aut sit error magni atque asperiores solutaaut cumque voluptatem occaecati omnis aliquid,peyme28,AA
830,dolores tenetur rerum et aliquamculpa officiis ea rem neque modi quaerat deseruntmolestias minus nesciunt iusto impedit enim laborum perferendisvelit minima itaque voluptatem fugiat,reedpeedu8,WS
831,maxime incidunt velit quam vel fugit nostrum veritatiset ipsam nisi voluptatem voluptas cumque tempora velit etet quisquam errormaiores fugit qui dolor sit doloribus,whitepants842,WS
832,voluptas iste delenitiest itaque vel ea incidunt quia voluptates sapiente repellataut consectetur vel neque tempora esse similique seda qui nobis voluptate hic eligendi doloribus molestiae et,bb9,WS
833,et dolor error doloremqueodio quo sunt quodest ipsam assumenda in veniam illum rerum deleniti expeditavoluptate hic nostrum sed dolor et qui,shortsmith0,G4
834,et voluptatibus est et aperiam quaerat voluptate eius quonihil voluptas doloribus et ea temporelabore non doloremoptio consequatur est id quia magni voluptas enim,bestbig0,G4
835,hic et et aspernatur voluptates voluptas ut ut idexcepturi eligendi aspernatur nulla dicta absuscipit quis distinctio nihiltemporibus unde quasi expedita et inventore consequatur rerum ab,rustycanada10,G4
836,similique autem voluptatem ab et etodio animi repellendus libero voluptas voluptas quialibero facere saepe nobisconsequatur et qui non hic ea maxime nihil,nahbuddy138,B6
837,est ut aut ut omnis distinctioillum quisquam pariatur qui aspernatur vitaedolor explicabo architecto veritatis ipsa et aut est molestiaeducimus et sapiente error sed omnis,okshon2e8,AS
838,maiores totam quo atqueexplicabo perferendis iste facilis odio ab eius consequatursit praesentium ea vitae optio minusvoluptate necessitatibus omnis itaque omnis qui,dunkcontestisrigged00,WN
839,dicta dolorem veniam ipsa harum minus sequiomnis quia voluptatem autemest optio doloribus repellendus id commodi quas exercitationem eumet eum dignissimos accusamus est eaque doloremque,goatforever23,B6
840,est aut consequatur error illo utenim nihil fugasuscipit inventore officiis iure earum pariatur temporibus inaperiam qui quod vel necessitatibus velit eos exercitationem culpa,nextgswstar00,WS
841,iure ea ea neque estesse ab sed hic et ullam sed sequi anon hic tenetur sunt enim ealaudantium ea natus,ddneedaring00,DL
842,quis beatae quisequi dicta quas et dolornon enim aspernatur excepturi aut rerum asperioresaliquid animi nulla ea tempore esse,greenson013,WS
843,ea alias eos et corruptivoluptatem ab inciduntvoluptatibus voluptas ea nesciunttotam corporis dolor recusandae voluptas harum,learningrol813,WN
844,iusto nihil quae rerum laborum recusandae voluptatem et necessitatibusut deserunt cumque qui quinon et et eos adipisci cupiditate dolor sed voluptatesmaiores commodi eveniet consequuntur,imamoody81,WN
845,omnis et fugit eos sint saepe ipsam unde estdolores sit sit assumenda laboriosamdolor deleniti voluptatem id nesciunt etplaceat dolorem cumque laboriosam sunt non,reliablecenter831,G4
846,quas non magnamquia veritatis assumenda reiciendissimilique dolores est abpraesentium fuga ut,baldpatrick831,G4
847,consectetur illo corporis sit labore optio quodqui occaecati aut sequi quiaofficiis quia aut odio quo adrerum tenetur aut quasi veniam,iggyisback9,WN
848,perferendis dignissimos soluta ut provident sit etdelectus ratione ad sapiente qui excepturi error qui quoquo illo commodirerum maxime voluptas voluptatem,needabrack81,G4
849,dicta impedit nonet laborum laudantium qui eaque et beatae suscipitsequi magnam rem dolorem non quia vel adipiscicorrupti officiis laudantium impedit,heretosaveyall81,F9
850,eaque rerum tempore distinctioconsequatur fugiat veniam et incidunt ut ut etconsequatur blanditiis magnamdoloremque voluptate ut architecto facere in dolorem et aut,wisejames91,F9
851,quo nisi impedit velit repellendus esse itaque ut saepevoluptatibus occaecati ab eaque doloresmaxime alias velit ducimus placeat sit laudantium quiacorrupti doloremque ut,antlamb1,AC
852,dolorem eius voluptatem vitae aliquid unde labore estmolestiae labore dolorem beatae voluptatem soluta eum eos doloreet ea quasi aut doloribus sintvel suscipit tempora delectus soluta,jacklamb89,UA
853,nemo aut laborum expedita nisi sed illumab asperiores providenta sunt recusandae ut rerum itaque est voluptatibus nihilesse ipsum et repellendus nobis rerum voluptas et,savedgswnation0148,DL
854,delectus est consequaturat excepturi asperiores dolor nesciunt adid non aut ad utnon et voluptatem,bestcoach138,B6
855,vel cumque labore vitae quisquam magnam sequi utmolestiae dolores vel minus autquas repellat nostrum fugit molestiae veritatis sequivel quidem in molestiae id doloribus sed,lalela912,WS
856,fugiat dolore voluptas temporeaspernatur quibusdam rem iste sit fugiat nesciunt consequaturdolor sed odit similique minima corporis quae in adipisciimpedit dolores et cupiditate accusantium perferendis dignissimos error,fraserwood814,WN
857,et eos est quis quia molestiae estquasi est quos omnisaut et sit consectetur ex molestiaeest sed accusamus asperiores,chrimarco81,WN
858,unde ad id nemo ipsam dolorem autem quaeratperspiciatis voluptas corrupti laborum rerum est architectoeius quos aut et voluptate voluptatem atque necessitatibusvoluptate fugiat aut iusto et atque,jevic4642,F9
859,et explicabo voluptatem ut est nihil culpa etveritatis repellendus ipsum velit qui eligendi maxime voluptatem estdicta rerum et et nemo quiaeveniet aspernatur nostrum molestiae mollitia ut dolores rem fugiat,weems841,WN
860,sit et aut recusandaecorrupti nisi vero eius nulla voluptatesvoluptatem placeat est commodi impedit odio omnissimilique debitis et in molestiae omnis sed non magni,redrubin184,DL
861,cum ad porro fuga sequi doloresipsa error magni itaque labore accusamuscorporis odit consequatur quis debitiscum et voluptas facilis incidunt ut itaque dolores error,vereenanthe65578,AS
