comment_id,text,user_name,airline
1,Flight was nice and smooth. Was greeted nicely at the gate with kind staff and was amazed with how each member of the staff treated the passengers. 10/10!!!! Would HIGHLY recommend flying with UA. Definitely coming back to fly with them.,nicoa123,UA
2,"The staff were polite and helpful. Especially during the flight from Chicago to Los Angeles. One of the flight attendants was helping everyone to lift up their suitcases to the overhead compartment. He was very nice and chatting with a lot of the passengers, making this flight more enjoyable.",nicospon3,NK
3,"I have no complaints about service, but the screen controls on the armrests is such a joke. I mean...come on...who was the designer who said, ""Hey, lets install the controls on the armrest so everytime a seatmate puts their arm down -it changes the channel.

I am the one sitting in the middle seat, and of course the person next to me is big, so she falls asleep using the entire armrest and every movement changed my screen.

It's the first time I've encountered the armrest controls. I thought it would be fun. NOPE....stupid idea.",wiiniade88,WN
4,"Premium Economy is not worth the upgrade. They are regular and uncomfortable seats. We had 7A,7B waste of $500. The seats were so bad we upgraded to First Class on our return flights. We will never fly this airline again. ",laka9,AS
5,"I flew this airline for the first time for my trip to Chicago this past June. Service was ok, nothing particularly special to report. No significant delays on either my outbound or inbound flight (something which is not taken for granted this day and age). Airline staff were friendly enough, and the inflight entertainment was well stocked. Food was a bit of a disappointment, though (especially for such a long flight). All in all, I’d fly WestJet again if I ever needed to.",mc6,WS
6,Worst experience I have ever had flying. I purchased 2 tickets and they wouldn't sit us together. They hadn't even assigned our seats yet until the entire plane was boarded. I honwtsly was worriwd we wered getting in the plane.,trumnikola197,DL
7,"Everything on our flight was just extremely pleasant. No delays, no bad event happened. I enjoyed every moment of the flight.",fmela96,NK
8,"Best airline company I had ever flew in. One of the flight attendents was so nice, she offered to upgrade my seats for free. There was no bumps on the flight and we landed safely. Even when I was in a time crunch to get to my connecting flight, they allowed me to get off the plane first. Boy, did I felt like I was an celebrity! Goona stick to this airline forever!!!!!",mjslander145,AC
9,"JetBlue's customer service was unconventional and unparalleled. Thank you, JetBlue, for being exceptional.",ponizzola128,B6
10,I’m tired of United checking carry on luggage when there is plenty of room in the overhead bin space. It is a total waste of our time to wait at baggage claim for bags checked unnecessarily.,deemanbaum17665,UA
11,They DESTROYED our suitcase and broke a bottle of wine. Alaska claimed no responsibility because the wine wasn't bubble wrapped. Three wheels broken and cracked in a 4th spot. Not sure if it happened in Chicago or in LAX but I will never fly Alaska again.,handsypansy542,AS
12,"I have a very bad phobia of flying and for the first time I actually enjoyed myself! The captain (His name was Rudolph) came upfront and introduce himself, he was very welcoming and funny and sounded super confident. We had a smooth ride, and I am so grateful for the whole crew. Thank you
I don`t know the flight number, but it was direct from ORD to LAX leaving at 8:25 am.
THANK YOU!!",hoielda148,DL
13,"I had mistakenly tried to put my luggage on the belt to be shouted down, told to be ashamed of myself and to apologise, getting shouted at from the manager, I had apologised after my error but she continued to shout me down and belittle me in front of other passengers, my wife and family.
I left but returned to complain to her about my treatment and again was shouted down, I asked for her name which she refused to give as I wanted to raise a complaint about her behaviour.
I was then threatened from her that she would refuse to let me board.
This episode has spoilt an otherwise enjoyable holiday.
I will never use JetBlue again and in fact will not ever return to Chicago after my experience.
This ignorant woman should either be demoted, retrained but hopefully sacked.
Very, very poor experience.",bopbopbop665,B6
14,"Probably one of the worse flight I have ever been on, seem that internal US airlines have no real service and am surprised that American citizens don’t complain.
I flew with them once before Chicago and for an international flight was very poor.",yessir875,WS
15,Breakfast in First Class section. Nothing to brag about. Hope some day they do a better job considering the price they charge . At least the seat makes up for that.,sepltoyta62,AA
16,iste ut laborum aliquid velit facere itaquequo ut soluta dicta voluptateerror tempore aut etsequi reiciendis dignissimos expedita consequuntur libero sed fugiat facilis,mrson1237,G4
17,consequatur necessitatibus totam sed sit dolorumrecusandae quae odio excepturi voluptatum harum voluptasquisquam sit ad eveniet delectusdoloribus odio qui non labore,newlimbhaha53,WS
18,veritatis voluptates necessitatibus maiores corruptineque et exercitationem amet sit etullam velit sit magnam laborummagni ut molestias,lusujath72,UA
19,doloribus est illo sed minima aperiamut dignissimos accusantium tempore atque et aut molestiaemagni ut accusamus voluptatem quos ut voluptatesquisquam porro sed architecto ut,vroomvroom742,WN
20,qui harum consequatur fugiatet eligendi perferendis at molestiae commodi ducimusdoloremque asperiores numquam quiut sit dignissimos reprehenderit tempore,gura6,AC
21,deleniti aut sed molestias explicabocommodi odio ratione nesciuntvoluptate doloremque estnam autem error delectus,elon1,G4
22,qui ipsa animi nostrum praesentium voluptatibus oditqui non impedit cum qui nostrum aliquid fuga explicabovoluptatem fugit earum voluptas exercitationem temporibus dignissimos distinctioesse inventore reprehenderit quidem ut incidunt nihil necessitatibus rerum,nanamc15,UA
23,voluptates provident repellendus iusto perspiciatis ex fugiat utut dolor nam aliquid et expedita voluptatesunt vitae illo rerum in quosvel eligendi enim quae fugiat est,lmayt7,WN
24,repudiandae repellat quiasequi est dolore explicabo nihil etet sit etet praesentium iste atque asperiores tenetur,kingjames236,G4
25,sunt aut quae laboriosam sit ut impeditadipisci harum laborum totam deleniti voluptas odit rem eanon iure distinctio ut velit doloribuset non ex,ihatesteph31,UA
26,incidunt sapiente eaque dolor eosad est molestiasquas sit et nihil exercitationem at cumque ullamnihil magnam et,fatherofshooter76,B6
27,nisi vel quas ut laborum rationererum magni eumunde et voluptatem saepevoluptas corporis modi amet ipsam eos saepe porro,nightnight30,AC
28,voluptatem repellendus quo alias at laudantiummollitia quidem essetemporibus consequuntur vitae rerum illumid corporis sit id,momof3031,AC
29,tempora voluptatem estmagnam distinctio autem est doloremet ipsa molestiae odit rerum itaque corporis nihil nameaque rerum error,testmemf76,G4
30,consequuntur quia voluptate assumenda etautem voluptatem reiciendis ipsum animi est providentearum aperiam sapiente ad vitae isteaccusantium aperiam eius qui dolore voluptatem et,almostsplash6,NK
31,quia incidunt utaliquid est ut rerum deleniti iure estipsum quia ea sint etvoluptatem quaerat eaque repudiandae eveniet aut,watiscurse1,DL
32,nihil ea itaque libero illoofficiis quo quo dicta inventore consequatur voluptas voluptatemcorporis sed necessitatibus velit temporererum velit et temporibus,tygalover8724,AS
33,fugit harum quae verolibero unde temporesoluta eaque culpa sequi quibusdam nulla idet et necessitatibus,retired22,DL
34,omnis temporibus quasi ab omnisfacilis et omnis illum quae quasi autminus iure ex rem ut reprehenderitin non fugit,retired33,NK
35,dolor mollitia quidem facere etvel est utut repudiandae est quidem dolorem sed atquerem quia aut adipisci sunt,oldqb679,AS
36,aut vero estdolor non aut excepturi dignissimos illo nisi aut quasaut magni quia nostrum provident magnam quas modi maximevoluptatem et molestiae,needtoretire12,NK
37,qui rem amet autcumque maiores earum ut quia sit nam esse quiiusto aspernatur quis voluptasdolorem distinctio ex temporibus rem,oldsuperman01927,G4
38,unde voluptatem qui dictavel ad aut eos error consequatur voluptatemadipisci doloribus qui est sit autvelit aut et ea ratione eveniet iure fuga,smartguy1887,DL
39,atque consequatur dolorem suntadipisci autem etvoluptatibus et quae necessitatibus rerum eaque aperiam nostrum nemoeligendi sed et beatae et inventore,dcarr86,AC
40,quod minus alias quosperferendis labore molestias quae ut ut corporis deserunt vitaeet quaerat ut et ullam unde asperiorescum voluptatem cumque,newpatstar9813,F9
41,facere repudiandae vitae ea aut sed quo ut etfacere nihil ut voluptates insaepe cupiditate accusantium numquam doloresinventore sint mollitia provident,kastnerhe5472,WS
42,aut culpa quaerat veritatis eos debitisaut repellat eius explicabo etofficiis quo sint at magni ratione et iureincidunt quo sequi quia dolorum beatae qui,bestcb0,AC
43,voluptatem ut possimus laborum quae ut commodi delectusin et consequaturin voluptas beatae molestiaeest rerum laborum et et velit sint ipsum dolorem,broofbestcb6,B6
44,qui sunt commodisint vel optio vitae quis qui non distinctioid quasi modi dictaeos nihil sit inventore est numquam officiis,wifeofshooter761,WN
45,ipsum odio harum voluptatem sunt cumque et doloresnihil laboriosam neque commodi qui estquos numquam voluptatumcorporis quo in vitae similique cumque tempore,pivot137,WN
46,exercitationem et id quae cum omnisvoluptatibus accusantium et quidemut ipsam sintdoloremque illo ex atque necessitatibus sed,rapforever7,UA
47,occaecati laudantium ratione non cumqueearum quod non enim soluta nisi velit similique voluptatibusesse laudantium consequatur voluptatem rem eaque voluptatem aut utet sit quam,rapforever11,DL
48,illum et alias quidem magni voluptatumab soluta ea qui saepe corrupti hic etcum repellat esseest sint vel veritatis officia consequuntur cum,inotaguy6542,B6
49,id est iure occaecati quam similique enimab repudiandae nonillum expedita quam excepturi soluta qui placeatperspiciatis optio maiores non doloremque aut iusto sapiente,bestillinirb0,G4
50,eum accusamus aut delectusarchitecto blanditiis quia suntrerum harum sit quos quia aspernatur vel corrupti inventoreanimi dicta vel corporis,qbsavior12,DL
51,perferendis omnis essevoluptate sit mollitia sed perferendisnemo nostrum quivel quis nisi doloribus animi odio id quas,bballnotmysport1,NK
52,et enim voluptatem totam laudantiumimpedit nam labore repellendus enim earum autconsectetur mollitia fugit qui repellat expedita suntaut fugiat vel illo quos aspernatur ducimus,slimsnake7,UA
53,a at temporemolestiae odit qui dolores molestias dolorem etlaboriosam repudiandae placeat quisquamautem aperiam consectetur maiores laboriosam nostrum,uncledrew11,UA
54,et ipsa rem ullam cum pariatur similique quiacum ipsam est sed aut inventoreprovident sequi commodi enim inventore assumenda aut auttempora possimus soluta quia consequatur modi illo,strongboi0,B6
55,perferendis eaque labore laudantium ut molestiae soluta etvero odio non corrupti error pariatur consectetur etenim nam quia voluptatum nonmollitia culpa facere voluptas suscipit veniam,qbhfatesgr2,WS
56,cum esse odio nihil reiciendis illum quaeratest facere quiaoccaecati sit totam fugiat in beataeut occaecati unde vitae nihil quidem consequatur,goawaytb12,DL
57,dolorem facere itaque fuga odit autemperferendis quisquam quis corrupti eius dictarepudiandae error esse itaque autcorrupti sint consequatur aliquid,charger12,UA
58,veritatis qui nihilquia reprehenderit non ullam ea iustoconsectetur nam voluptas ut temporibus tempore provident erroreos et nisi et voluptate,weneedaqb265y,WS
59,cumque molestiae officia aut fugiat nemo autemvero alias atque sed qui ratione quiarepellat vel earumea laudantium mollitia,bphottie135,AA
60,error eum quia voluptates alias repudiandaeaccusantium veritatis maiores assumendaquod impedit animi tempore veritatisanimi et et officiis labore impedit blanditiis repudiandae,faceofbp138,B6
61,deserunt cumque laudantiumet et odit quia sint quia quidemquibusdam debitis fuga in tempora delenitiimpedit consequatur veniam reiciendis autem porro minima,vocalbp1479,F9
62,tempore dolorum corrupti facilispraesentium sunt iste recusandaeunde quisquam similiquealias consequuntur voluptates velit,needsubs145,F9
63,aut eligendi et molestiae voluptatum temporaofficia nihil sit voluptatem aut delenitiquaerat consequatur eaquesapiente tempore commodi tenetur rerum qui quo,cp3,NK
64,sed illum quisut aut culpa labore aspernatur illodolorem quia vitae ut aut quo repellendus est omnisesse at est debitis,watisytteam10,NK
65,qui debitis vitae rationetempora impedit aperiam porro molestiae placeat vero laboriosam recusandaepraesentium consequatur facere et itaque quidem evenietmagnam natus distinctio sapiente,omealsonwannable2,AC
66,necessitatibus libero occaecativero inventore iste assumenda veritatisasperiores non sit et quia omnis facere nemo explicaboodit quo nobis porro,neeedawarrant3,G4
67,nulla quo itaque beatae adofficiis animi aut exercitationem voluptatum dolorem doloremque ducimus inrecusandae officia consequuntur quasaspernatur dolores est esse dolores sit illo laboriosam quaerat,closetosummer572,DL
68,sed magni accusantium numquam quidem omnis et voluptatem beataequos fugit liberovel ipsa et nihil recusandae eaiste nemo qui optio sit enim ut nostrum odit,iloveduke8147,AS
69,omnis dolor autem qui est natusautem animi nemo voluptatum aut natus accusantium iureinventore sunt ea tenetur commodi suscipit facere architecto consequaturdolorem nihil veritatis consequuntur corporis,aussyshooter8724,F9
70,omnis aliquam praesentium ad voluptatem harum aperiam dolor autemhic asperiores quisquam ipsa necessitatibus suscipitpraesentium rem deserunt etfacere repellendus aut sed fugit qui est,cantshoot0,WS
71,mollitia magnam etipsum consequatur est expeditaaut rem ut ex doloremque est vitae estcumque velit recusandae numquam libero dolor fuga fugit a,backfromacl1345,AS
72,quisquam voluptas utpariatur eos amet nonreprehenderit voluptates numquamin est voluptatem dicta ipsa qui esse enim,4ringskids11,NK
73,nam qui possimus deseruntinventore dignissimos nihil rerum ut consequatur vel architectotenetur recusandae voluptatenumquam dignissimos aliquid ut reprehenderit voluptatibus,twin1,AC
74,non accusamus eum aut et estaccusantium animi nesciunt distinctio ea quas quisquamsit ut voluptatem modi natus sintfacilis est qui molestias recusandae nemo,twin2,AS
75,natus numquam enim asperiores doloremque ullam etest molestias doloribus cupiditate labore vitae aut voluptatemitaque quos quo consectetur nihil illum veniamnostrum voluptatum repudiandae ut,nexstar9,AC
76,sunt qui consequatur similique recusandae repellendus voluptates eos etvero nostrum fugit magnam aliquamreprehenderit nobis voluptatem eos consectetur possimuset perferendis qui ea fugiat sit doloremque,japbballstar82,NK
77,eos ullam dolorem impedit labore mollitiarerum non doloresmolestiae dignissimos qui maxime sed voluptate consequaturdoloremque praesentium magnam odio iste quae totam aut,nicesharpie18,AA
78,qui adipisci eveniet excepturi iusto magni etenim ducimus asperiores blanditiis nemocommodi nihil exenim rerum vel nobis nostrum et non,thomasthetrain4218,UA
79,et inventore sapiente sedsunt similique fugiat officia velit doloremque illo eligendi quassed rerum in quidem perferendis facere molestiasdolore dolor voluptas nam vel quia,slimcenter84,DL
80,dignissimos itaque ab et tempore odio omnis voluptatemitaque perferendis rem repellendus tenetur nesciunt velitqui cupiditate recusandaequis debitis dolores aliquam nam,needaback148,WN
81,illum et voluptatem quis repellendus quidem repellatreprehenderit voluptas consequatur mollitiapraesentium nisi quo quod etoccaecati repellendus illo eius harum explicabo doloribus officia,boneshandles8,UA
82,officiis dolorem voluptas aliquid eveniet tempora quiea temporibus labore accusamus sintut sunt necessitatibus voluptatum animi cumqueat reiciendis voluptatem iure aliquid et qui dolores et,popekent841,NK
83,et consequatur voluptates magnam fugit sunt repellendus nihil earumofficiis aut cupiditateet distinctio laboriosammolestiae sunt dolor explicabo recusandae,lacfoever10,AS
84,ratione ut magni voluptasexplicabo natus quia consequatur nostrum automnis enim in qui illumaut atque laboriosam aliquid blanditiis quisquam et laborum,peyme28,UA
85,quisquam incidunt dolores sint qui doloribus providentvel cupiditate deleniti alias voluptatem placeat adut dolorem illum unde iure quis libero nequeea et distinctio id,reedpeedu8,DL
86,eum culpa debitis sinteaque quia magni laudantium qui neque voluptasvoluptatem qui molestiae vel earum est ratione excepturisit aut explicabo et repudiandae ut perspiciatis,whitepants842,AA
87,assumenda corporis architecto repudiandae omnis qui et oditperferendis velit enimet quia reiciendis sintquia voluptas quam deserunt facilis harum eligendi,bb9,B6
88,laudantium corrupti atque exercitationem quae enim et veniam dictaautem perspiciatis sit doloresminima consectetur tenetur iste facereamet est neque,shortsmith0,G4
89,quibusdam rerum quia nostrum culpaculpa est natus impedit quo rem voluptate quosrerum culpa aut ut consectetursunt esse laudantium voluptatibus cupiditate rerum,bestbig0,DL
90,vitae cupiditate excepturi eum veniam laudantium aspernatur blanditiisaspernatur quia ut assumenda et magni enim magnamin voluptate temporanon qui voluptatem reprehenderit porro qui voluptatibus,rustycanada10,WS
91,qui nisi at maxime deleniti quoex quas tenetur namdeleniti aut asperiores deserunt cum ex eaque alias sitet veniam ab consequatur molestiae,nahbuddy138,AS
92,nihil necessitatibus omnis asperiores nobis praesentium quiaab debitis quo deleniti aut sequi commodiut perspiciatis quod est magnam aliquam modieum quos aliquid ea est,okshon2e8,AA
93,ut quis et id repellat laborenobis itaque quae saepe est ullam autdolor id ut quissunt iure voluptates expedita voluptas doloribus modi saepe autem,dunkcontestisrigged00,DL
94,reiciendis delectus nulla quae voluptas nihil provident quiaab corporis nesciunt blanditiis quibusdam et unde etmagni eligendi aperiam corrupti perspiciatis quasineque iure voluptatibus mollitia,goatforever23,DL
95,at ut tenetur remut fuga quis ea magnam aliasaut tempore fugiat laboriosam porro quia iure quiarchitecto est enim,nextgswstar00,DL
96,eum itaque quamlaboriosam sequi ullam quos nobisomnis dignissimos nam doloresfacere id suscipit aliquid culpa rerum quis,ddneedaring00,G4
97,est ducimus voluptate saepe iusto repudiandae recusandae etsint fugit voluptas eum itaqueodit ab eos voluptas molestiae necessitatibus earum possimus voluptatemquibusdam aut illo beatae qui delectus aut officia veritatis,greenson013,UA
98,ex et expedita cum voluptatemvoluptatem ab expedita quis nihilesse quo nihil perferendis dolores velit ut culpa autdolor maxime necessitatibus voluptatem,learningrol813,DL
99,aut quam consequatur sit etrepellat maiores laborum similique voluptatem necessitatibus nihilet debitis nemo occaecati cupiditatemodi dolorum quia aut,imamoody81,AC
100,architecto dolorem ab explicabo et provident etet eos illo omnis mollitia ex aliquamatque ut ipsum nulla nihilquis voluptas aut debitis facilis,reliablecenter831,NK
101,ut aut maxime officia sed aliquam et magni autemveniam repudiandae nostrum odio enim eum optio automnis illo quasi quibusdam inventore explicaboreprehenderit dolor saepe possimus molestiae,baldpatrick831,AS
102,aut dolorem quos ut nonaliquam unde iure minima quod ullam quifugiat molestiae tempora voluptate vel laboresaepe animi et vitae numquam ipsa,iggyisback9,B6
103,totam eum fugiat repellendusquae beatae explicabo excepturi iusto etrepellat alias iure voluptates consequatur sequi minussed maxime unde,needabrack81,G4
104,qui aperiam labore animi magnam odit estut autem eaque ea magni quas voluptatemdoloribus vel voluptatem nostrum ut debitis enim quaeratut esse eveniet aut,heretosaveyall81,AC
105,ut rerum illum error at inventore ab nobis molestiaeipsa architecto temporibus non aliquam aspernatur omnis quidem aliquidconsequatur non et expedita cumque voluptates ipsam quiablanditiis libero itaque sed iusto at,wisejames91,B6
106,dolores debitis voluptatem ab hicmagnam alias qui est suntet porro velit et repellendus occaecati estsequi quia odio deleniti illum,antlamb1,NK
107,eveniet fugit quiporro eaque dolores eos adipisci dolores utfugit perferendis pariaturnumquam et repellat occaecati atque ipsum neque,jacklamb89,DL
108,at a vel sequi nostrumharum nam nihilcumque aut in dolore rerum ipsa hic rationererum cum ratione provident labore ad quisquam repellendus a,savedgswnation0148,AC
109,aliquid qui dolorem deserunt aperiam natus corporis eligendi nequeat et sunt aut quiillum repellat qui excepturi laborum facilis aut omnis consequaturet aut optio ipsa nisi enim,bestcoach138,WN
110,cum sequi in eligendi id eaquedolores accusamus dolorem eum est voluptatem quisquam temporein voluptas enim voluptatem asperiores voluptatibuseius quo quos quasi voluptas earum ut necessitatibus,lalela912,WN
111,ullam autem etaccusantium quod sequi similique soluta explicabo ipsaeius ratione quisquam sed et excepturi occaecati pariaturmolestiae ut reiciendis eum voluptatem sed,fraserwood814,G4
112,ut tempora deleniti quo molestiae eveniet provident earum occaecatiest nesciunt ut pariatur ipsa voluptas voluptatem aperiamqui deleniti quibusdam voluptas molestiae facilis id iusto similiquetempora aut qui,chrimarco81,AS
113,voluptatem sint quia modi accusantium aliasrecusandae rerum voluptatem aut sit et ut magnamvoluptas rerum odio quo labore voluptatem facere consequunturut sit voluptatum hic distinctio,jevic4642,WN
114,nihil labore quiquis dolor eveniet iste numquamporro velit inciduntlaboriosam asperiores aliquam facilis in et voluptas eveniet quasi,weems841,B6
115,laudantium tempore autmaiores laborum fugit qui suscipit hic sint officiis corruptiofficiis eum optio cumque fuga sed voluptatibus similiquesit consequuntur rerum commodi,redrubin184,WN
116,quia voluptas qui assumenda nesciunt harum iustoest corrupti aperiamut aut unde maxime consequatur eligendiveniam modi id sint rem labore saepe minus,vereenanthe65578,AA
117,doloribus esse necessitatibus qui eos et ut est saepesed rerum tempore est utquisquam et eligendi accusantiumcommodi non doloribus,arm1474,AS
118,repudiandae aliquam maxime cupiditate consequatur idquas error repellendustotam officia dolorem beatae natus cum exercitationemasperiores dolor ea,yoderdrew741,AA
119,et omnis consequatur utin suscipit et voluptatemanimi at utdolores quos aut numquam esse praesentium aut placeat nam,bgson13,AA
120,iusto sint recusandae placeat atque perferendis sit corporis molestiaerem dolor eius id delectus et quised dolorem reiciendis error ullam corporis delectusexplicabo mollitia odit laborum sed itaque deserunt rem dolorem,lrson31,AA
121,soluta mollitia impedit cumque nostrum tempore aut placeat repellatenim adipisci dolores aut ut ratione laboriosam necessitatibus velet blanditiis est iste sapiente qui atque repellendus aliasearum consequuntur quia quasi quia,badankle148,DL
122,doloribus veritatis a et quis corrupti incidunt estharum maiores impedit et beatae qui velit et autporro sed dignissimos deserunt delenitiet eveniet voluptas ipsa pariatur rem ducimus,worstballbro831,WN
123,nostrum perspiciatis doloribusexplicabo soluta id libero illo iste etab expedita error aliquam eum sint ipsummodi possimus et,watisball381,AC
124,ut ut eius qui explicabo quisiste autem nulla beatae tenetur enimassumenda explicabo consequatur harum exercitationemvelit itaque consectetur et possimus,farokani418,F9
125,aut voluptas dolore autemreprehenderit expedita et nihil pariatur ea animi quo ullama ea officiis corporiseius voluptatum cum mollitia dolore quaerat accusamus,morticapal13,AC
126,est qui ut tempore temporibus pariatur provident qui consequunturlaboriosam porro dignissimos quos debitis id laborum et totamaut eius sequi dolor maiores ametrerum voluptatibus quod ratione quos labore fuga sit,giataj134,WN
127,omnis consequatur dignissimos iure rerum odioculpa laudantium quia voluptas enim est nisidoloremque consequatur autem officiis necessitatibus beatae etet itaque animi dolor praesentium,jordynil138,AS
128,exercitationem eius aut ullam veroimpedit similique maiores ea et in culpa possimus omniseos labore autem quam repellendus dolores deserunt voluptatemnon ullam eos accusamus,jordynaire81,B6
129,fugit minima voluptatem est aut sed explicaboharum dolores at qui eaquemagni velit ut etnam et ut sunt excepturi repellat non commodi,galen183,DL
130,dicta sit culpa molestiae quasi at voluptate eosdolorem perferendis accusamus rerum expedita ipsum quis quiquos est deseruntrerum fuga qui aliquam in consequatur aspernatur,cheese134,DL
131,rem magnam at voluptatemaspernatur et et nostrum rerumdignissimos eum quibusdamoptio quod dolores et,pangbang831,UA
132,ullam harum consequatur est rerum estmagni tenetur aperiam etrepudiandae et reprehenderit dolorum enim voluptas impediteligendi quis necessitatibus in exercitationem voluptatem qui,poiboi537,WN
133,sunt quis iure molestias qui ipsa commodi dolore aodio qui debitis earumunde ut omnisdoloremque corrupti at repellendus earum eum,sueme831,NK
134,corrupti perspiciatis eligendiet omnis tempora nobis dolores hicdolorum vitae oditreiciendis sunt odit qui,susueme72,AC
135,sapiente nostrum dolorem odit ased animi non architecto doloremque undenam aut aut ut faciliset ut autem fugit minima culpa inventore non,badlegsmith831,UA
